Knights College,142272,"1,918",53,"1,971",92.49%,142272,0,124258,1610668800,6,,knights-college,"KnightsCollege is a kemono visual novel set in the Knight College, where elite knight candidates live. In this game, every choice is presented as a card, and the protagonist lives in the dormitory while collecting cards.",https://www.igdb.com/games/knights-college,,,,1,,,116505,,,,,,,,,,,,,,,,,,"One day, Argo, a young man living a leisurely life in a fishing village in the countryside, receives a letter of recommendation from the Knights College of his dreams. Not knowing why he was recommended, he enrolls and spends his days with his fellow knight candidates.

In KnightsCollege, all conversations and movements are done through card-based selection. Each time you get a new card, it unlocks a conversation, opens up a different route, or increases your likability with the character.",,,,,,,,,,,,,,,,,,,,,,,
The Coin Game,99192,"4,900",204,"5,104",92.48%,99192,0,89687,1550793600,6,,the-coin-game,"A virtual ticket redemption arcade with realistic physics, silly prizes and a bunch of goofy robots. The Coin Game is made by a solo developer. Be sure to add us to your wishlist for new announcements.",https://www.igdb.com/games/the-coin-game,,,,1,,,245695,,,,,,,,,,,,,,,,,1,,,,,4,,,,,,,,,,,,,,,,,,,
Brick Rigs,30650,"41,972","2,569","44,541",92.47%,30650,0,169219,1689292800,6,,brick-rigs,"Build your own vehicles or download one of more than 10,000 vehicles from the workshop and enjoy the dynamic driving and destruction physics of Brick Rigs!",https://www.igdb.com/games/brick-rigs,,,6,1,2,,270741,,,,,,,,,,,,,,,,,2,,,,,4,,,,,,,,,,,,,,,,,,,
Journey,137294,"30,441","1,797","32,238",92.47%,137294,1,113748,1599523200,6,14,the-sims-4-journey-to-batuu,"Create your Sim's unique Star Wars story as you explore the remote world of Batuu, from Galaxy's Edge at Disneyland and Disney World, in The Sims 4: Journey to Batuu. Will your Sim join up with the Resistance, fall in with the scoundrels, or enlist with the First Order? It's up to you! Build up your Sim's reputation to unlock missions, purchase a lightsaber or droid, and meet iconic Star Wars characters like Rey and Kylo Ren.",https://www.igdb.com/games/the-sims-4-journey-to-batuu,75,2,280,1,,,141841,141842,,,,,,,,48,49,167,169,,,,,1,"Visit iconic locations from the Star Wars saga as you complete challenges and special missions to tip the balance of power. Every decision your Sims make counts in the grand scheme of a galactic conflict. Who knows, maybe you’ll even find love along the way.

Your Sims are definitely not at home anymore. From the Millennium Falcon to the bustling cantina and unique attire of Batuu, Sims will be surrounded by the iconic sights and sounds of Star Wars.

When your Sim returns home, bring back new decor and recipes inspired by your travels, play a game of sabacc, or host a playful lightsaber training session.

Every adventurous Sim needs a lightsaber and a droid. Collect kyber crystals to construct your unique lightsaber, then head to the Droid Depot to get a trusty companion to accompany you on missions.

Be careful who you trust. Batuu is home to the scruffy and the scheming, the noble and the brave; so choose your allies carefully. First Order, Resistance or Scoundrels - the choice is up to you.

Once you’ve chosen a faction, complete missions, collect rewards and earn reputation points. Climbing the chain of command by completing missions also begins to introduce new faction contacts like Vi Moradi and Rey.",21209,,,,,,,,,,,,,2,3,,,,,,,,
SteamWorld Dig 2,218691,"6,706",305,"7,011",92.47%,218691,3,248775,,,,steamworld-dig-2-plus-steamworld-dig,,https://www.igdb.com/games/steamworld-dig-2-plus-steamworld-dig,,,,,,,,,,,,,,,,,,,,,,,,,,,,,,,,,,,,,,,,,,,,,,,,
Unsorted Horror,258669,"1,705",44,"1,749",92.47%,258669,0,322829,1690848000,6,,unsorted-horror,"UNSORTED HORROR is a collection of 5 short first-person horror games, that revolve around detailed machinery in a dark dystopian setting. The majority of the games have a playtime of roughly 10-15 minutes and can be played through in one sitting. Choose a CD case, read the backside, and go on a small adventure.

THE GAMES:
1. Tartarus Engine - A group of plucky technicians exploit an ancient machine's seemingly untapped vulnerability.
2. The Other Side - Operate a jury-rigged drill to secretly escape a corrupt bunker.
3. Control Room Alpha - Pull data from a nest of spiders.
4. Carbon Steel - Perform hazardous research in an abandoned facility.
5. Concrete Tremor - A game revolving around plastic explosives and soviet apartment buildings.",https://www.igdb.com/games/unsorted-horror,,,,1,,,270397,,,,,,,,,,,,,,,,,1,,,,,,,,,,,,,,,,,,,,,,,,
Derail Valley,29564,"5,547",241,"5,788",92.46%,29564,0,200719,1548374400,6,162,derail-valley,"Drive massive trains and build your career in a vast open railway network. For both PC and VR.

What makes Derail Valley different?

You can feel the physics. Walk without restrictions, in and out of locomotives, changing them as you see fit. Couple and uncouple trains as you complete your deliveries. Choose new deliveries freely. Take many at once if you will. Service your trains after derailing. Do this all spontaneously, and at any point you can save and continue later.

Built from the ground up for Virtual Reality - optional

Derail Valley fully supports playing on a regular PC, using mouse and keyboard on a flat screen, but virtual reality is where it really shines. In VR you can, for the first time ever, truly be inside train cabs and operate controls with your own hands. Derail Valley supports all major PC VR headsets, such as Oculus, Windows Mixed Reality, Valve and HTC.",https://www.igdb.com/games/derail-valley,,,750,1,,,159323,,,,,,,,,163,,,,,,,,1,,,,,4,,,,,,,,,,7,,,,,,,,,
DEADBOLT,18389,"5,038",213,"5,251",92.46%,18389,0,274571,1457913600,3,6,deadbolt,Deadbolt is an extremely challenging stealth-action hybrid that allows you to take control of the reaper to quell the recent undead uprising.,https://www.igdb.com/games/deadbolt,75,2,79,1,,,196301,196319,,,,,,,,46,48,130,,,,,,4,,,,,,,,,,,,,,,,,,,,,,,,
Higurashi When They Cry Hou - Ch.1 Onikakushi,33967,"4,669",193,"4,862",92.46%,33967,9,300624,1431648000,3,6,higurashi-when-they-cry-hou-ch-dot-1-onikakushi,"Higurashi When They Cry is a sound novel.

The music, backgrounds and characters work together to create a world that is the stage of a novel for the user to read. They laugh and cry and get angry. The user takes the point of view of the protagonist to experience the story.",https://www.igdb.com/games/higurashi-when-they-cry-hou-ch-dot-1-onikakushi,,,13,1,,,228723,228724,228725,,,,,,,14,130,,,,,,,5,"The 58th year of Shouwa, early summer
It’s June, and the summer heat has arrived earlier than it does most years.
By day there are crickets, and by night there are cicadas.

We’re in Hinamizawa, a small village in the countryside.
There are fewer than two thousand people here. But every year, there is an event.

This event is a mysterious death.
(The series has run from 1979 to 1983)

On a certain day in June, someone dies, and someone else goes missing.
The series of deaths is connected to the upheaval surrounding the dam construction project.
A murder case that was covered up is being reenacted.
Is it a conspiracy? A coincidence? Or perhaps a curse?

Someone who was supposed to be there isn’t.
Someone who wasn’t supposed to be there is.

Someone who was alive last night is dead now.
And someone who is here right now isn’t alive.

So, there is no way to avert tragedy. There is no choice but to give up.
But don’t give up.

Only you can stand up to this.",29499,,,,,,,,,,,,,6,,,746,,,,,,
Door Kickers 2,59078,"7,678",363,"8,041",92.45%,59078,0,114080,1604361600,6,,door-kickers-2,"Command military Special Ops Teams in gripping tactical combat against a Middle East-based terrorist network. Sequel to RockPaperShotgun's ""Best Tactics Game of 2014"".",https://www.igdb.com/games/door-kickers-2,,,,1,2,3,107556,,,,,,,,,,,,,,,,,,,,,,4,,,,,,,,,,,,,,,,,,,
Nova Lands: Emilia's Mission,216972,"1,788",48,"1,836",92.45%,216972,0,261430,1665964800,6,,nova-lands-emilias-mission,"Nova Lands: Emilia's Mission is a prologue chapter of the main game, Nova Lands. Learn your way around the planet you've landed on, build your base, and automate it with your helpful bots!",https://www.igdb.com/games/nova-lands-emilias-mission,,,,,,,,,,,,,,,,,,,,,,,,,,,,,,,,,,,,,,,,,,,,,,,,
A Dance of Fire and Ice,114392,"64,166","4,116","68,282",92.43%,114392,0,94392,1548288000,3,6,a-dance-of-fire-and-ice,A Dance of Fire and Ice is a simple one-button rhythm game.,https://www.igdb.com/games/a-dance-of-fire-and-ice,,,13,1,,,193084,193085,,,,,,,,14,34,39,130,,,,,4,Keep your focus as you guide two orbiting planets along a winding path without breaking their perfect equilibrium.,,,,,,,,,,,,,,,,,,,,,,,
Little Nightmares II,121760,"36,016","2,185","38,201",92.43%,121760,0,79321,1612915200,6,48,little-nightmares-ii,"Little Nightmares II is a suspense-adventure game in which you play as Mono, a young boy trapped in a world that has been distorted by the humming transmission of a distant tower. With Six, the girl in a yellow raincoat, as his guide, Mono sets out to discover the dark secrets of The Signal Tower and save Six from her terrible fate; but their journey will not be straightforward as Mono and Six will face a gallery of new threats from the terrible residents of this world.

Will you dare to face this collection of new, little nightmares?",https://www.igdb.com/games/little-nightmares-ii,82.23076923076923,21,439,1,,,120994,120995,173993,,,,,,,49,130,167,169,170,,,,2,,12140,20971,,,,,,,,,,,,4,,,,,,,,,
Strange Horticulture,186597,"10,631",541,"11,172",92.43%,186597,0,201899,1642723200,6,14,strange-horticulture,"An occult puzzle game in which you play as the proprietor of a local plant store. Find and identify new plants, pet your cat, speak to a coven, or join a cult. Use your collection of powerful plants to influence the story and unravel Undermere’s dark mysteries.",https://www.igdb.com/games/strange-horticulture,90,2,,1,,,160909,160910,,,,,,,,34,39,48,49,130,169,,,4,,23560,,,,,,,,,,,,,,,,,,,,,,
Neon Beats,191455,"6,166",278,"6,444",92.43%,191455,1,,1584057600,6,14,neon-beats-a-beat-further,"Neon Beats: A Beat Further is a DLC pack for Neon Beats, a 2D platformer game with rhythm based levels. Your favorite minimalist platformer returns with more content! Discover new mechanics, 5 new levels and new music!",https://www.igdb.com/games/neon-beats-a-beat-further,,,,1,,,163779,163780,,,,,,,,,,,,,,,,4,,,,,,,,,,,,,,,,,,,,,,,,
Cobalt Core,232416,"2,829",98,"2,927",92.43%,232416,0,333753,1699401600,6,130,cobalt-core,"A sci-fi roguelike deckbuilder with a deep new single-axis spin on tactics games! Dodge missiles, line up your cannons, and blast 'em out of the sky... Then get to the bottom of these time loops, before it's too late!",https://www.igdb.com/games/cobalt-core,87,1,104,1,,,200851,200852,,,,,,,,,,,,,,,,,,,,,,,,,,,,,,,,,,,,,,,,
Aero GPX,219704,696,5,701,92.43%,219704,0,281516,1722902400,6,,aero-gpx,"Aero GPX is an anti-gravity racer focused on high velocity, flight, machine-to-machine combat, and responsive controls that are easy to pick up but difficult to master. Fight for the best position possible with high speeds, risky maneuvers, and visceral attacks!",https://www.igdb.com/games/aero-gpx,,,6,1,2,,,,,,,,,,,,,,,,,,,2,,,,,,,,,,,,,,,,,,465,,,,,,
Hotline Miami 2: Wrong Number,2126,"57,188","3,642","60,830",92.42%,2126,0,181986,1425945600,3,6,hotline-miami-2-wrong-number,"A sequel, sidequel and prequel to Hotline Miami (2012) with similar unlockables, violent top-down gameplay and '80s Miami/modern electronic aesthetics, Hotline Miami 2 follows multiple factions related to the events of the original game as they commit increasingly bloody and surreal acts. A greater emphasis is put on storytelling, and the boundaries between real and fictional violence.",https://www.igdb.com/games/hotline-miami-2-wrong-number,71.3076923076923,16,79,1,,,34947,34949,34951,68734,,,,,,9,14,46,48,49,130,167,169,3,"A brutal conclusion to the gruesome saga, Hotline Miami 2: Wrong Number follows the escalating level of violence through multiple factions born from the events of the original game and driven by uncertain motivations. Step into the murderous mind of several distinct characters - each with their own motivations and methods of execution -- as storylines intersect and reality slips away into a haze of neon and carnage. Blistering combat, an unmistakable visual style, and a powerfully intense soundtrack will once again push you to the limit and questioning your own thirst for blood.",19305,,,,,,,,170,,,,,,,,,,,,,,
Shower With Your Dad Simulator 2015: Do You Still Shower With Your Dad,12204,"9,379",467,"9,846",92.42%,12204,0,281271,1441152000,6,,shower-with-your-dad-simulator-2015-do-you-still-shower-with-your-dad,"""Shower With Your Dad Simulator 2015: Do You Still Shower With Your Dad?"" is a fast paced shower-simulation where you shower with your 8-bit dad. It's good, clean fun!",https://www.igdb.com/games/shower-with-your-dad-simulator-2015-do-you-still-shower-with-your-dad,,,,1,,,25946,,,,,,,,,,,,,,,,,3,,,,,,,,,,,,,,,,,,,,,,,,
Cassette Beasts,133866,"7,140",334,"7,474",92.42%,133866,0,248502,1682467200,3,6,cassette-beasts,Grab your cassette player - it's time to transform! Collect awesome monster forms to use during turn-based battles in this indie open-world RPG. Combine any two monster forms using Cassette Beasts' Fusion System to create unique and powerful new ones!,https://www.igdb.com/games/cassette-beasts,100,2,456,1,2,3,175008,175009,,,,23095,,,,34,39,49,130,169,,,,2,"Welcome to New Wirral, a remote island inhabited by creatures you've only dreamed of, nightmares you hopefully haven't, and a cast of brave folks who use cassette tapes to transform for battle. To find a way home you'll need to explore every inch of the island, and record monsters to tape to gain their abilities!",26832,26833,,,,,,,,,,,,4,,,,,,,,,
Class of '09,152962,"5,122",220,"5,342",92.42%,152962,0,193978,1623283200,3,6,class-of-09,"This is the anti-visual novel. Instead of playing as some guy magically able to score with beautiful anime girls, YOU play the anime girl and create mass chaos in the lives of your potential ""suitors"". Earnest comedy, social accuracy, and late 2000's aesthetic await you in Class of '09!",https://www.igdb.com/games/class-of-09,,,,1,,,280768,,,,,,,,,14,,,,,,,,,,,,,,,,,,,,,,,,,,,,,,,,
Coffee Talk,106847,"9,880",498,"10,378",92.41%,106847,0,240765,1580256000,6,14,coffee-talk,"Coffee Talk is a coffee brewing and heart-to-heart talking simulator about listening to fantasy-inspired modern peoples’ problems, and helping them by serving up a warm drink or two.",https://www.igdb.com/games/coffee-talk,70,4,601,1,,,190481,200202,,,,,,,,48,49,130,167,,,,,1,,11152,20738,,,,,,,,,,,,5,,,,,,,,,
Mortal Sin,148700,"2,346",75,"2,421",92.41%,148700,0,248691,1678838400,6,,mortal-sin,An Action-Horror Roguelike unlike any other where you must strategically dismember horrific monsters to survive. Discover powerful weapons and magic as you explore beautifully detailed and haunting environments which are randomly generated on every playthrough.,https://www.igdb.com/games/mortal-sin,81,1,603,1,,,157309,,,,,,,,,,,,,,,,,1,,,,,4,,,,,,,,,,,,,,,,,,,
YOU and ME and HER: A Love Story,133256,"4,041",162,"4,203",92.40%,133256,0,194300,1372377600,6,,you-and-me-and-her-a-love-story,"You and Me and Her: A Love Story is the visual novel medium in its purest form. Will Shinichi choose Miyuki, the beautiful queen bee of the school, or the endearingly awkward misfit Aoi? With art by Tsuji Santa, these beautifully rendered romances will stay with you forever.",https://www.igdb.com/games/you-and-me-and-her-a-love-story,,,,1,,,98408,98409,,,,,,,,,,,,,,,,5,"Life is like a staircase. You just gotta keep climbing. Otherwise, if you start to overthink it, you'll have trouble taking the next step.

Shinichi wants nothing more than to lead a quiet life. Though he was once close friends with Miyuki, the most popular girl in school, his desire for normalcy now keeps them from being anything more than classmates.

Everything changes, however, one day on the roof, when the class oddball, Aoi, suddenly tries to kiss him. Miyuki appears just in time to stop her, but afterward, Shinichi feels the urge to bring some light to this friendless girl's eyes. He enlists Miyuki's aid, and thus, a trio is born.

The days pass, and little by little, Aoi learns what it means to be friends. But at the same time, long-dormant feelings awaken in Miyuki's heart. As the distance between her and Shinichi shrinks, the hard-earned bonds the three share begin to fray.

Miyuki or Aoi－when the time comes, which will Shinichi choose?",12926,26499,,,,,,,,,,,,,,,,,,,,,
COMPOUND,28927,"1,962",57,"2,019",92.40%,28927,0,247975,1526342400,163,386,compound,"COMPOUND is a randomized, rogue-lite, free-roaming shooter for Virtual Reality veterans. Duck and dodge around enemy fire in a tough-as-nails retro FPS with multiple locomotion options. Prepare to die - a lot - until you are good enough to reach the heart of The Corporation and take back what belongs to everyone...",https://www.igdb.com/games/compound,,,,1,,,281344,281345,,,,,,,,390,,,,,,,,7,,,,,,,,,,,,,,,,,,,,,,,,
Jerma's Big Adventure,165471,"1,251",26,"1,277",92.40%,165471,0,173183,1630022400,6,,jermas-big-adventure,"Oh no! Jerma985 has fallen into a spooky cavern filled with ROBOT dinosaurs and EVIL warlocks. In this wacky action-platformer, fight to escape the treacherous cavern while a live studio chat cheers you on!",https://www.igdb.com/games/jermas-big-adventure,,,1145,1,,,146699,,,,,,,,,,,,,,,,,4,"Oh no!

What began as a normal, innocuous stream for renown internet clown Jerma985—the shpee guy—ended in DISASTER when in an unforeseeable freak accident, Jerma came tumbling down to the deep depths of a dark, spooky cavern.

Armed with only his trusty baseball bat, Jerma must fight his way through hordes of laser-shooting ROBOT dinosaurs and EVIL electric warlocks to escape the treacherous cave alongside reactions from a live studio chat!",,,,,,,,,,,,,,,,,,,,,,,
CARRION,90055,"23,275","1,351","24,626",92.39%,90055,0,111846,1595462400,3,6,carrion,Carrion is a reverse horror game in which you assume the role of an amorphous alien being. Use your unique otherworldly abilities to your advantage and hunt down your prey!,https://www.igdb.com/games/carrion,74.55555555555556,11,104,1,,,282601,282602,290031,,,,,,,14,48,49,130,167,,,,4,,20598,,,,,,,,,,,,,,,,,,,,,,
Supraland Six Inches Under,172903,"2,937",105,"3,042",92.39%,172903,0,203255,1642118400,6,48,supraland-six-inches-under,"Supraland Six Inches Under has exploration, puzzles, and combat! A first-person-metroidvania taking place six inches under Supraland.",https://www.igdb.com/games/supraland-six-inches-under,,,439,1,,,216717,216718,230041,,,,,,,49,130,167,169,,,,,1,,,,,,,,,,,,,,,,,,,,,,,,
Grim Dawn,1907,"88,551","5,879","94,430",92.38%,1907,0,188536,1456358400,6,49,grim-dawn,"Enter an apocalyptic fantasy world where humanity is on the brink of extinction, iron is valued above gold and trust is hard earned. This ARPG features complex character development, hundreds of unique items, crafting and quests with choice & consequence.",https://www.igdb.com/games/grim-dawn,82,4,,1,2,3,33348,,,,,527,,,,,,,,,,,,3,,,,,,,,,,,,,,,,,,,,,,,,
Marvel's Guardians of the Galaxy,200836,"33,555","2,040","35,595",92.38%,200836,3,231305,1652140800,6,48,marvels-guardians-of-the-galaxy-plus-marvels-avengers,A bundle including Marvel's Guardians of the Galaxy and Marvel's Avengers.,https://www.igdb.com/games/marvels-guardians-of-the-galaxy-plus-marvels-avengers,,,,,,,178173,178174,178175,,,,,,,49,167,169,,,,,,,,17148,21898,,,,,,,,,,,,,,,,,,,,,
Devil Daggers,18081,"8,404",412,"8,816",92.38%,18081,0,86802,1455753600,3,6,devil-daggers,"Inspired by 1990s FPS and arcade games, Devil Daggers is a fast-paced shooter that places you in an abyssal arena to face endless legions of demons. Armed with versatile magic daggers and a fluid movement system, fight to survive as long as you can. Compete for precious seconds with Steam Friends or on global leaderboards. Your spirit and skill will be tested.",https://www.igdb.com/games/devil-daggers,78.33333333333333,4,,1,,,33181,,,,,,,,,14,,,,,,,,1,,,,,,,,,,,,,,,,,,,,,,,,
Total Annihilation,918,"3,166",117,"3,283",92.38%,918,0,214119,875577600,6,14,total-annihilation,"What began as a conflict over the transfer of consciousness from flesh to machines escalated into a war which has decimated a million worlds. The Core and the Arm have all but exhausted the resources of a galaxy in their struggle for domination. Both sides now crippled beyond repair, the remnants of their armies continue to battle on ravaged planets, their hatred fuelled by over four thousand years of total war. This is a fight to the death. For each side, the only acceptable outcome is the complete elimination of the other.",https://www.igdb.com/games/total-annihilation,,,,1,2,,1985,1986,,,,1642,,,,,,,,,,,,3,,,,,,,,,,,,,,,,,,,,,,,,
The Test: Secrets of the Soul,236101,"1,292",28,"1,320",92.38%,236101,0,289701,1676851200,6,,the-test-secrets-of-the-soul,"You will answer a series of questions that will reveal things from deep within. Some will be uncomfortable, but with great knowledge comes great sacrifice. Can you make it all the way through The Test, and are you SURE you want the answers you seek? For it is time to unlock ""Secrets of the Soul...""",https://www.igdb.com/games/the-test-secrets-of-the-soul,,,,1,,,,,,,,,,,,,,,,,,,,,,,,,,,,,,,,,,,,,,,,,,,,
UNDERDOGS,251563,"1,244",26,"1,270",92.38%,251563,0,366874,1706140800,163,386,underdogs,"Wrap yourself in 5 tons of metal and go smashing through a dark scene of underground mech fights!

Bash, crush, maul and rip apart enemy bots and mechs - it’s full-on metal-on-metal violence in this first of its kind physics-based mech brawler.

But rampaging through the pits ain’t all - this is a Roguelike.
Gear up with 100+ items including power tools like chainsaws and wrecking balls, hire hackers and saboteurs, hustle and deal with the gangsters and psychos who run these streets as you claw your way up the food chain.",https://www.igdb.com/games/underdogs,90,1,,1,,,237857,,,,,,,,,471,,,,,,,,7,,,,,,,,,,,,,,,,,,,,,,,,
Leaf Blower Revolution - Idle Game,141416,"22,328","1,294","23,622",92.37%,141416,0,121210,1607040000,6,34,leaf-blower-revolution-idle-game,"Leaf Blower Revolution is a Free to Play idle game where you blow away leaves with nuclear leaf blowers, unlock upgrades, earn achievements, and more. Try out Leaf Blower Revolution now and watch numbers going up!",https://www.igdb.com/games/leaf-blower-revolution-idle-game,,,,1,,,198761,,,,,,,,,39,,,,,,,,3,,,,,,,,,,,,,,,,,,,,,,,,
Farmer Against Potatoes Idle,199507,"5,597",250,"5,847",92.37%,199507,0,245202,1725321600,6,34,farmer-against-potatoes-idle,"Pick up your sword and fight off waves of Potatoes by upgrading your stats constantly, use Equipment, choose between different Classes, put your many Talents to good use, and so much more designed to keep you entertained for a long time.",https://www.igdb.com/games/farmer-against-potatoes-idle,,,,1,,,,,,,,,,,,39,,,,,,,,4,,,,,,,,,,,,,,,,,,,,,,,,
Yellow Taxi Goes Vroom,216805,854,11,865,92.37%,216805,0,365311,1712620800,6,,yellow-taxi-goes-vroom,Make full use of your advanced move-set to navigate hand-crafted retro worlds without a jump button in this vibrant love letter to the N64 era of collectathons!,https://www.igdb.com/games/yellow-taxi-goes-vroom,,,13,1,,,202314,202315,,,,,,,,,,,,,,,,2,"Pizza King, Morio and Ultra Chad are only a few of the weirdos you'll interact with as you piece together the narrative puzzle and unravel the grand conspiracy happening on Granny's Island!",,,,,,,,,,,,,,,,,,,,,,,
Into the Breach,20193,"18,191","1,028","19,219",92.36%,20193,0,128633,1334361600,6,,scp-containment-breach,SCP: Containment Breach is a free survival horror game written in Blitz3D.,https://www.igdb.com/games/scp-containment-breach,,,358,1,,,287686,,,,,,,,,,,,,,,,,1,"You play as D-9341, one of many Class-D test subjects used by the SCP Foundation, an organization dedicated to containing and safe-guarding anomalous creatures and artifacts from the rest of the world. The game opens with D-9341 waking up and being pulled from his cell to begin testing. However, during the test the facility begins to malfunction, causing a site-wide containment breach to occur.",,,,,,,,,,,,,,,,,,,,,,,
Cosmoteer: Starship Architect & Commander,54687,"9,382",474,"9,856",92.35%,54687,0,236815,1666569600,6,,cosmoteer-starship-architect-and-commander,Cosmoteer is a 2D top-down starship design and combat game developed by Walternate Realities for PC.,https://www.igdb.com/games/cosmoteer-starship-architect-and-commander,,,1152,1,2,3,91388,,,,,20273,,,,,,,,,,,,3,,,,,4,,,,,,,,,,,,,,,,,,,
Quake II,286,"8,199",403,"8,602",92.35%,286,0,91137,881625600,3,6,quake-ii,"Quake II is a first-person shooter video game developed by id Software and published by Activision. It is not a direct sequel to Quake, id decided to revert to an existing trademark when they were unable to agree on a new name that did not violate another company's trademark.",https://www.igdb.com/games/quake-ii,,,97,1,2,3,1068,1071,1072,145781,150184,21323,,,,7,12,14,16,240,,,,1,,,,,,150185,272991,,,,,,,,,,,,,,119455,,261085,
