_key,id,positive ratings,negative ratings,total reviews,rating percentage,info/0/id,info/0/category,info/0/cover,info/0/first_release_date,info/0/platforms/0,info/0/platforms/1,info/0/slug,info/0/summary,info/0/url,info/0/aggregated_rating,info/0/aggregated_rating_count,info/0/game_engines/0,info/0/game_modes/0,info/0/game_modes/1,info/0/game_modes/2,info/0/involved_companies/0,info/0/involved_companies/1,info/0/involved_companies/2,info/0/involved_companies/3,info/0/involved_companies/4,info/0/multiplayer_modes/0,info/0/multiplayer_modes/1,info/0/multiplayer_modes/2,info/0/multiplayer_modes/3,info/0/platforms/2,info/0/platforms/3,info/0/platforms/4,info/0/platforms/5,info/0/platforms/6,info/0/platforms/7,info/0/platforms/8,info/0/platforms/9,info/0/player_perspectives/0,info/0/storyline,info/0/game_localizations/0,info/0/game_localizations/1,info/0/game_modes/3,info/0/status,info/0/involved_companies/5,info/0/involved_companies/6,info/0/involved_companies/7,info/0/involved_companies/8,info/0/platforms/10,info/0/platforms/11,info/0/platforms/12,info/0/platforms/13,info/0/platforms/14,info/0/player_perspectives/1,info/0/player_perspectives/2,info/0/remakes/0,info/0/game_engines/1,info/0/game_engines/2,info/0/platforms/15,info/0/remasters/0,info/0/game_engines/3,info/0/remasters/1,info/0/player_perspectives/3
Portal 2,99969,"401,349","5,312","406,661",97.70%,99969,1,399776,1308268800,6,9,portal-2-in-motion,"Get Portal2 In Motion, Adventure, Puzzle, Shooter, First Person Shooter game for PS3 console from the official PlayStation website. Know more about Portal2 In Motion Game.",https://www.igdb.com/games/portal-2-in-motion,,,,,,,,,,,,,,,,,,,,,,,,,,,,,,,,,,,,,,,,,,,,,,,,
Stardew Valley,17000,"747,919","12,739","760,658",97.51%,17000,0,14012,1456444800,3,6,stardew-valley,"Stardew Valley is an open-ended country-life RPG! You’ve inherited your grandfather’s old farm plot in Stardew Valley. Armed with hand-me-down tools and a few coins, you set out to begin your new life. Can you learn to live off the land and turn these overgrown fields into a thriving home? It won’t be easy. Ever since Joja Corporation came to town, the old ways of life have all but disappeared. The community center, once the town’s most vibrant hub of activity, now lies in shambles. But the valley seems full of opportunity. With a little dedication, you might just be the one to restore Stardew Valley to greatness!",https://www.igdb.com/games/stardew-valley,90.53846153846153,17,103,1,2,3,55275,55277,70732,96480,96481,9964,9965,9966,9967,14,34,39,41,46,48,49,130,3,"You’ve inherited your grandfather’s old farm plot in Stardew Valley. Armed with hand-me-down tools and a few coins, you set out to begin your new life. Can you learn to live off the land and turn these overgrown fields into a thriving home? It won’t be easy. Ever since Joja Corporation came to town, the old ways of life have all but disappeared. The community center, once the town’s most vibrant hub of activity, now lies in shambles. But the valley seems full of opportunity. With a little dedication, you might just be the one to restore Stardew Valley to greatness!",1880,5401,,,,,,,,,,,,,,,,,,,,,
People Playground,122646,"256,855","3,615","260,470",97.47%,122646,0,196394,1563840000,6,,people-playground,"Shoot, stab, burn, poison, tear, vaporise, or crush ragdolls in a large open space.",https://www.igdb.com/games/people-playground,,,13,1,,,115528,115529,,,,,,,,,,,,,,,,4,,,,,,,,,,,,,,,,,,,,,,,,
Vampire Survivors,186725,"232,095","3,542","235,637",97.33%,186725,0,202171,1643673600,6,14,vampire-survivors,"Mow thousands of night creatures and survive until dawn! Vampire Survivors is a gothic horror casual game with rogue-lite elements, where your choices can allow you to quickly snowball against the hundreds of monsters that get thrown at you.",https://www.igdb.com/games/vampire-survivors,91.4,6,,1,2,3,195857,,,,,23674,24379,,,34,39,48,49,130,167,169,,3,,26124,29602,4,,,,,,,,,,,,,,,,,,,,
Hades,113112,"263,680","4,541","268,221",97.19%,113112,0,152760,1600300800,6,14,hades--1,"A rogue-lite hack and slash dungeon crawler in which Zagreus, son of Hades the Greek god of the dead, attempts to escape his home and his oppressive father by fighting the souls of the dead through the various layers of the ever-shifting underworld, while getting to know and forging relationships with its inhabitants.",https://www.igdb.com/games/hades--1,94.0625,20,149,1,,,258983,258984,265600,,,,,,,39,48,49,130,167,169,,,3,"Zagreus, the son of Hades, has discovered that his mother, which he was led to believe was Nyx, Night Incarnate, is actually someone else, and is outside Hell. He is now attempting to escape his father's domain, with the help of the other gods of Olympus, in an attempt to find his real mother.",11478,20810,,,,,,,,,,,,,,,,,,,,,
Portal,317175,"162,350","2,528","164,878",97.16%,317175,0,412245,1726876800,6,34,brazilian-drug-dealer-3-i-opened-a-portal-to-hell-in-the-favela-trying-to-revive-mit-aia-i-need-to-close-it--1,"Brazilian Drug Dealer 3 is a fast-paced ultraviolent Brazilian old-school FPS heavily inspired by the first Quake, using the same engine as the game (ID TECH2). made as a tribute to the Brazilian mods of the 2000s, the Brazilian bootleg games of the 2000s, Brazilian music, and the King of Brazilian music, Mit Aia!",https://www.igdb.com/games/brazilian-drug-dealer-3-i-opened-a-portal-to-hell-in-the-favela-trying-to-revive-mit-aia-i-need-to-close-it--1,,,97,1,2,3,287715,,,,,30306,30307,,,,,,,,,,,1,"You are a Mit Aia fan, a legend of Brazilian 70s funk music, and you tried to revive him in the favela where you live with a Pentagram, things took a bad turn and you opened a portal to hell! All the people in the state of Rio de Janeiro got Posseeessed! It’s up to you to find a way to stop the hell invasion!",,,,4,,,,,,,,,,,,,,,,,,,
HoloCure - Save the Fans!,206336,"30,955",239,"31,194",97.05%,206336,0,326103,1656028800,6,,holocure-save-the-fans--1,"Collect powerful weapons and items and experiment with all kinds of builds to create the ultimate character! Will you be able to defeat the endless waves of enemies, and reach the top rankings?",https://www.igdb.com/games/holocure-save-the-fans--1,,,79,1,,,176742,,,,,,,,,,,,,,,,,3,"In the year 20xx, an uprising began. A new group of idols surfaced on the internet, known as virtual idols. People were skeptical at first, but over time, these virtual idols gathered many fans. Many grew to love these ""Vtubers"" very much. However, one day an evil force came in and took advantage of the fans and their love. The evil force brainwashed the fans, turning them into mindless minions blinded by their own love.
The vtubers knew they had to help their fans come back to their senses.
And this began their quest... to save the fans!",,,,3,,,,,,,,,,,,,,,,,,,
Terraria,1879,"1,303,041","33,014","1,336,055",96.85%,1879,0,82068,1305504000,3,6,terraria,"Dig, Fight, Explore, Build: The very world is at your fingertips as you fight for survival, fortune, and glory. Will you delve deep into cavernous expanses in search of treasure and raw materials with which to craft ever-evolving gear, machinery, and aesthetics? Perhaps you will choose instead to seek out ever-greater foes to test your mettle in combat? Maybe you will decide to construct your own city to house the host of mysterious allies you may encounter along your travels? In the World of Terraria, the choice is yours!",https://www.igdb.com/games/terraria,81,17,,1,2,3,16887,188985,188989,189038,189039,7506,8284,9954,,9,12,14,34,37,39,41,46,4,,3388,19296,,,189040,189041,190256,190257,48,49,74,130,170,,,,,,,,,,
RimWorld,9789,"190,515","3,902","194,417",96.77%,9789,0,71529,1539734400,3,6,rimworld,"A sci-fi colony sim driven by an intelligent AI storyteller. Generates stories by simulating psychology, ecology, gunplay, melee combat, climate, biomes, diplomacy, interpersonal relationships, art, medicine, trade, and more.",https://www.igdb.com/games/rimworld,74.5,3,13,1,,,95510,,,,,,,,,14,,,,,,,,3,"RimWorld follows three survivors from a crashed space liner as they build a colony on a frontier world at the rim of known space. Inspired by the space western vibe of Firefly, the deep simulation of Dwarf Fortress, and the epic scale of Dune and Warhammer 40,000.

Manage colonists' moods, needs, thoughts, individual wounds, and illnesses. Engage in deeply-simulated small-team gunplay. Fashion structures, weapons, and apparel from metal, wood, stone, cloth, or exotic, futuristic materials. Fight pirate raiders, hostile tribes, rampaging animals and ancient killing machines. Discover a new generated world each time you play. Build colonies in biomes ranging from desert to jungle to tundra, each with unique flora and fauna. Manage and develop colonists with unique backstories, traits, and skills. Learn to play easily with the help of an intelligent and unobtrusive AI tutor.",1674,4737,,,,,,,,,,,,,,,,,,,,,
Half-Life: Alyx,126098,"90,151","1,547","91,698",96.76%,126098,0,383452,1584921600,161,163,half-life-alyx,"Half-Life: Alyx is Valve’s VR return to the Half-Life series. It’s the story of an impossible fight against a vicious alien race known as the Combine, set between the events of Half-Life and Half-Life 2. Alyx Vance and her father Eli mount an early resistance to the Combine's brutal occupation of Earth.",https://www.igdb.com/games/half-life-alyx,92.77777777777777,11,557,1,,,150849,,,,,,,,,385,,,,,,,,7,"Playing as Alyx Vance, you are humanity’s only chance for survival. The Combine’s control of the planet since the Black Mesa incident has only strengthened as they corral the remaining population in cities. Among them are some of Earth’s greatest scientists: you and your father, Dr. Eli Vance.

As founders of a fledgling resistance, you’ve continued your clandestine scientific activity—performing critical research, and building invaluable tools for the few humans brave enough to defy the Combine.

Every day, you learn more about your enemy, and every day you work toward finding a weakness.",,,,,,,,,,,,,,,,,,,,,,,
Left 4 Dead 2,124,"867,662","22,184","889,846",96.74%,124,0,90807,1258416000,3,6,left-4-dead-2,"Left 4 Dead 2 is a cooperative first-person shooter video game, the sequel to Valve Corporation's Left 4 Dead. The Game builds upon cooperatively focused gameplay and Valve's proprietary Source engine, the same game engine used in the original Left 4 Dead. Set during the aftermath of an apocalyptic pandemic, Left 4 Dead 2 focuses on four new Survivors, fighting against hordes of the Infected, who develop severe psychosis and exhibit zombie-like tendencies. The Survivors must fight their way through five campaigns, interspersed with safe houses that act as checkpoints, with the goal of escape at each campaign's finale.",https://www.igdb.com/games/left-4-dead-2,88.6,7,3,1,2,3,7652,7653,7654,,,22812,,,,12,14,,,,,,,1,,32485,,,,,,,,,,,,,,,,,,,,,,
The Henry Stickmin Collection,120710,"45,901",624,"46,525",96.74%,120710,3,122431,1596758400,6,14,the-henry-stickmin-collection,"The Henry Stickmin Collection is a Newgrounds choose-your-own-path classic, reborn and revitalized. This 6-game epic culminates in multiple entirely canon, extremely different endings. Each step of the journey has you choose from options such as a Teleporter or calling in your buddy Charles to help you out. Correct choices will move the story forward, but incorrect choices lead to a fail. If you get to the end on your first try, you're doing it wrong. Failing is half the fun.",https://www.igdb.com/games/the-henry-stickmin-collection,,,,1,,,105468,105469,,,,,,,,,,,,,,,,,,,,,,,,,,,,,,,,,,,,,,,,
Pizza Tower,135818,"60,570",971,"61,541",96.67%,135818,0,273241,1674691200,6,130,pizza-tower,"Pizza Tower is a 2D platformer mainly inspired by Wario Land and Earthworm Jim. The game has over-the-top hand-drawn animations and music. You play as Peppino Spaghetti, a manic pizza man with many abilities like charging, super jumping and dashing. Peppino has to go up each floor of the tower by finding keys, saving toppins folks and getting as many points as possible!",https://www.igdb.com/games/pizza-tower,90,1,79,1,2,3,201876,,,,,,,,,,,,,,,,,4,"Peppino Spaghetti, a surprisingly agile and powerful fat balding italian, is on a mission to destroy the titular Pizza Tower in order to save his restaurant from annihilation. Follow him through his rampage across the many wacky floors of the tower, collecting toppings and beating up monsters!",25628,,,,,,,,,,,,,,,,,,,,,,
A Short Hike,116753,"17,114",137,"17,251",96.60%,116753,0,298371,1564444800,3,6,a-short-hike,"Hike, climb, and soar through the peaceful mountainside landscapes of Hawk Peak Provincial Park as you make your way to the summit.",https://www.igdb.com/games/a-short-hike,77.5,2,13,1,,,231609,231610,,,,,,,,14,48,49,130,,,,,3,"The main character is Claire, a young anthropomorphic bird who travels to Hawk Peak Provincial Park, where her Aunt May works as a ranger, to spend days off. However, Claire cannot get cellphone reception unless she reaches the top of the peak, and is expecting an important call. For this reason, she decides to reach the highest point in the park.",,,,,,,,,,,,,,,,,,,,,,,
Euro Truck Simulator 2,52973,"781,905","21,153","803,058",96.58%,52973,0,397441,1388448000,6,,euro-truck-simulator-2-legendary-edition,This version includes the base game plus 25 DLC.,https://www.igdb.com/games/euro-truck-simulator-2-legendary-edition,,,,1,,,116222,116223,,,,,,,,,,,,,,,,1,,,,,,,,,,,,,,,2,,,,,,,,,
Slay the Spire,296831,"162,279","3,568","165,847",96.56%,296831,0,376277,,6,,slay-the-spire-ii,"The iconic roguelike deckbuilder returns. Craft a unique deck, encounter bizarre creatures, and discover relics of immense power in Slay the Spire 2!",https://www.igdb.com/games/slay-the-spire-ii,,,,,,,262134,,,,,,,,,,,,,,,,,,,,,,,,,,,,,,,,,,,,,,,,,
Slime Rancher,16287,"122,498","2,601","125,099",96.52%,16287,0,331130,1501545600,3,6,slime-rancher,"Slime Rancher is a charming, first-person, sandbox experience. Play as Beatrix LeBeau: a plucky, young rancher who sets out for a life a thousand light years away from Earth on the 'Far, Far Range.' Each day will present new challenges and risky opportunities as you attempt to amass a great fortune in the business of slime ranching. Collect colorful slimes, grow crops, harvest resources, and explore the untamed wilds through the mastery of your all-purpose vacpack.",https://www.igdb.com/games/slime-rancher,77.66666666666667,4,13,1,,,69051,69052,,,,,,,,14,48,49,,,,,,1,"Slime Rancher is the tale of Beatrix LeBeau, a plucky, young rancher who sets out for a life a thousand light years away from Earth on the ‘Far, Far Range’ where she tries her hand at making a living wrangling slimes.",,,,,,,,,,,,,,,,,,,,,,,
ULTRAKILL,124333,"126,315","2,765","129,080",96.47%,124333,0,195411,1599091200,6,,ultrakill,Ultrakill is a fast-paced ultraviolent retro FPS combining the skill-based scoring from character action games with unadulterated carnage inspired by the best shooters of the 90's. Rip apart your foes with varied destructive weapons and shower in their blood to regain your health.,https://www.igdb.com/games/ultrakill,,,13,1,,,100529,108336,,,,,,,,,,,,,,,,1,"Mankind has gone extinct and the only beings left on earth are machines fueled by blood.
But now that blood is starting to run out on the surface...

Machines are racing to the depths of Hell in search of more.",,,,4,,,,,,,,,,,,,,,,,,,
Mount & Blade: Warband,2025,"159,329","3,691","163,020",96.45%,2025,0,91042,1269993600,3,6,mount-blade-warband,"In a land torn asunder by incessant warfare, it is time to assemble your own band of hardened warriors and enter the fray. Lead your men into battle, expand your realm, and claim the ultimate prize: the throne of Calradia!",https://www.igdb.com/games/mount-blade-warband,68.6,6,,1,2,,4315,4316,,,,7422,8166,,,14,48,49,,,,,,1,,,,,,,,,,,,,,,2,,,,,,,,,
Totally Accurate Battle Simulator,21642,"125,206","2,775","127,981",96.44%,21642,0,87347,1576800000,6,14,totally-accurate-battle-simulator,A physics based medieval battle simulator which lets you pit wacky waving armies against each other. In Totally Accurate Battle Simulator you pit waving arm men against each other and watch them fight it out.,https://www.igdb.com/games/totally-accurate-battle-simulator,,,13,1,2,,37993,241356,241357,,,,,,,34,39,48,49,130,167,,,1,,1939,,,,,,,,,,,,,2,3,,,,,,,,
The Binding of Isaac: Rebirth,309607,"294,207","7,583","301,790",96.42%,309607,0,398960,1627084800,38,,the-binding-of-isaac-rebirth--1,,https://www.igdb.com/games/the-binding-of-isaac-rebirth--1,,,,1,,,277586,,,,,,,,,,,,,,,,,3,,,,,,,,,,,,,,,,,,,,,,,,
Half-Life 2,267639,"195,614","4,841","200,455",96.38%,267639,5,336018,1545696000,6,,half-life-2-mmod-half-life-2-update--1,This mod is to run Half-Life 2: Update (itself a mod for the original Half-Life 2) under MMod.,https://www.igdb.com/games/half-life-2-mmod-half-life-2-update--1,,,3,1,,,276931,276932,,,,,,,,,,,,,,,,1,,,,,,,,,,,,,,,,,,,,,,,,
OneShot,131216,"46,464",816,"47,280",96.38%,131216,0,121691,1582761600,6,,oneshot--1,Oneshot? An endless fast-paced 2D top-down shooter. Nearly impossible. It might be too difficult for you. Do you have the will or determination? Find out now.,https://www.igdb.com/games/oneshot--1,,,,1,,,,,,,,,,,,,,,,,,,,,,,,,,,,,,,,,,,,,,,,,,,,
Cats Hidden in Jingle Jam,273813,"9,156",41,"9,197",96.38%,273813,0,346609,1701388800,6,,cats-hidden-in-jingle-jam,Find and discover 100 cute cats hidden around a festive holiday village in this FREE hand-drawn hidden object game. Can you find them all?,https://www.igdb.com/games/cats-hidden-in-jingle-jam,,,,1,,,241940,,,,,,,,,,,,,,,,,4,,,,,,,,,,,,,,,,,,,,,,,,
Lethal Company,212089,"424,130","11,749","435,879",96.36%,212089,0,257738,1698019200,6,,lethal-company,A co-op horror roguelite about an abandoned industrial moon.,https://www.igdb.com/games/lethal-company,,,13,1,2,3,239111,,,,,25376,,,,,,,,,,,,1,"You are a contracted worker for the Company. Your job is to collect scrap from abandoned, industrialized moons to meet the Company's profit quota. You can use the cash you earn to travel to new moons with higher risks and rewards--or you can buy fancy suits and decorations for your ship. Experience nature, scanning any creature you find to add them to your bestiary. Explore the wondrous outdoors and rummage through their derelict, steel and concrete underbellies. Just never miss the quota.",,,,4,,,,,,,,,,,,,,,,,,,
Helltaker,133152,"117,951","2,688","120,639",96.36%,133152,0,102743,1589155200,3,6,helltaker,Helltaker is a short game about sharply dressed demon girls.,https://www.igdb.com/games/helltaker,,,750,1,,,100896,,,,,,,,,14,,,,,,,,3,"You woke up one day with a dream. Harem full of demon girls. You've opened the portal in hopes of fulfilling your wildest desires. Hellfire burns through your lungs, death awaits around every corner and everything looks like from a cutesy mobile game. You are in Hell.",21118,,,,,,,,,,,,,,,,,,,,,,
VPet,292021,"41,560",712,"42,272",96.36%,292021,0,369079,1691884800,6,,vpet-simulator,"VPet is a desktop pet software that supports various interactive. it is open source, free and support Steam workshops.",https://www.igdb.com/games/vpet-simulator,,,,1,,,258389,,,,,,,,,,,,,,,,,,,,,,,,,,,,,,,,,,,,,,,,,
Cats Hidden in Paris,239812,"16,300",166,"16,466",96.36%,239812,0,319541,1689552000,6,,cats-hidden-in-paris,"Find 100 cats hiding in Paris, France in this cute hand-drawn hidden object game",https://www.igdb.com/games/cats-hidden-in-paris,,,,1,,,241943,,,,,,,,,,,,,,,,,4,,,,,,,,,,,,,,,,,,,,,,,,
Katana ZERO,20150,"66,436","1,328","67,764",96.35%,20150,0,71017,1555545600,6,14,katana-zero,"Katana Zero is a fast paced neo-noir action platformer, focusing on tight, instant-death acrobatic combat, and a dark 80's neon aesthetic. Aided with your trusty katana, the time manipulation drug Chronos and the rest of your assassin's arsenal, fight your way through a fractured city, and take back what's rightfully yours.",https://www.igdb.com/games/katana-zero,84.75,10,84,1,,,129659,129661,276145,276146,,,,,,34,39,49,130,,,,,4,,25922,,,,,,,,,,,,,,,,,,,,,,
Counter-Strike,241,"234,970","6,191","241,161",96.30%,241,0,375465,973728000,3,6,counter-strike,Play the world's number 1 online action game. Engage in an incredibly realistic brand of terrorist warfare in this wildly popular team-based game. Ally with teammates to complete strategic missions. Take out enemy sites. Rescue hostages. Your role affects your team's success. Your team's success affects your role.,https://www.igdb.com/games/counter-strike,70,2,4,2,,,5830,5831,211860,,,7856,,,,11,14,,,,,,,1,,,,,,,,,,,,,,,,,307,,,,,,,
Resident Evil 4,145201,"144,960","3,541","148,501",96.29%,145201,3,135617,1253145600,8,9,resident-evil-4-and-resident-evil-code-veronica-x-bundle,This pack includes Resident Evil 4 and Resident Evil CODE: Veronica X.,https://www.igdb.com/games/resident-evil-4-and-resident-evil-code-veronica-x-bundle,,,,,,,122888,,,,,,,,,,,,,,,,,,,153,,,,,,,,,,,,,,,,,,,,,,
Bloons TD 6,103380,"320,153","8,876","329,029",96.27%,103380,0,76628,1528934400,6,14,bloons-td-6,"The Bloons are back and better than ever! Craft your perfect defense from a combination of awesome monkey towers, upgrades, Heroes, and activated abilities, then pop every last Bloon that comes your way!",https://www.igdb.com/games/bloons-td-6,,,13,1,2,3,72900,,,,,12840,12841,12842,,34,39,48,49,472,,,,3,,,,,,,,,,,,,,,,,,,,,,,,
BeamNG.drive,17131,"267,054","7,297","274,351",96.25%,17131,0,84190,1428192000,6,,beamng-dot-drive,"BeamNG.drive is a realistic, immersive driving game offering near-limitless possibilities. Our soft-body physics engine simulates every component of a vehicle in real time, resulting in realistic, dynamic behavior.
The driving feel is authentic and visceral, and crashes are realistic and violent; yet the physics are accessible enough to drive with a keyboard or gamepad while still being authentic with a full racing wheel with uncompromising realism.",https://www.igdb.com/games/beamng-dot-drive,,,312,1,2,,31757,,,,,24757,24758,,,,,,,,,,,1,,,,,4,,,,,,,,,,2,7,,313,,,,,,
Plants vs. Zombies: Game of the Year,20546,"128,609","3,205","131,814",96.20%,20546,0,373745,1281312000,6,14,plants-vs-zombies-goty-edition,"Zombies are invading your home, and the only defense is your arsenal of plants! Armed with an alien nursery-worth of zombie-zapping plants like peashooters and cherry bombs, you'll need to think fast and plant faster to stop dozens of types of zombies dead in their tracks.",https://www.igdb.com/games/plants-vs-zombies-goty-edition,80,1,136,1,,,98094,,,,,,,,,,,,,,,,,4,,,,,,,,,,,,,,,,,,,,,,,,
Papa's Freezeria Deluxe,238347,"9,440",68,"9,508",96.16%,238347,9,287710,1680220800,6,,papas-freezeria-deluxe,"After starting a relaxing job at the oceanfront ice cream shop on Calypso Island, things get hectic when all of Papa Louie's crazy customers arrive on the island! Now it's up to you to single-handedly craft and serve tasty sundae treats throughout the year. You'll whip up delicious Freezer sundaes by pouring ice cream, adding mixables and syrups, blending sundaes, and finally adding whipped cream and toppings for that perfect summertime treat. You'll need to multitask between each area of the restaurant, where each station is a unique hands-on experience.",https://www.igdb.com/games/papas-freezeria-deluxe,,,63,1,,,204141,,,,,,,,,,,,,,,,,3,,,,,,,,,,,,,,,5,,,,,,,,,
ATRI -My Dear Moments-,131634,"18,715",257,"18,972",96.14%,131634,0,95718,1592438400,6,130,atri-my-dear-moments,"""As the world sank, I found you."" In the near future, a sudden and unexplained sea rise has left much of human civilization underwater. In a little town slowly being enveloped by the ocean, an unforgettable summer is about to begin for a boy and a mysterious robot girl...",https://www.igdb.com/games/atri-my-dear-moments,,,,1,,,93670,93671,93672,,,,,,,,,,,,,,,,"In the near future, a sudden and unexplained sea rise has left much of human civilization underwater.
Ikaruga Natsuki, a boy who lost his mother and his leg in an accident some years earlier, returns disillusioned from a harsh life in the big city to find his old countryside home half-swallowed by the sea.

Left without a family, all he has to his name is the ship and submarine left to him by his oceanologist grandmother, and her debts.

His only hope to restore the dreams for the future that he has lost is to take up an opportunity presented to him by the suspicious debt collector Catherine. They set sail to search the sunken ruins of his grandmother's laboratory in order to find a treasure rumor says she left there.

But what they find is not riches or jewels; it is a strange girl lying asleep in a coffin at the bottom of the sea.
Atri.

Atri is a robot, but her appearance and her wealth of emotions would fool anyone into think she's a living, breathing human being. In gratitude for being salvaged, she makes a declaration to Natsuki.

""I want to fulfill my master's final order. Until I do, I'll be your leg!""

In a little town slowly being enveloped by the ocean, an unforgettable summer is about to begin for this boy and this mysterious robot girl...",,,,,,,,,,,,,,,,,,,,,,,
