Hexcells,9603,"5,383",172,"5,555",93.40%,9603,0,98795,1378944000,3,6,hexcells,Hexcells is an ambient logic puzzle game in the vein of minesweeper.,https://www.igdb.com/games/hexcells,,,404,1,,,24230,125517,,,,,,,,14,39,,,,,,,1,,,,,,,,,,,,,,,,,,,,,,,,
Loddlenaut,152196,"2,940",70,"3,010",93.40%,152196,0,151932,1700092800,6,14,loddlenaut,"Loddlenaut is an ocean cleanup adventure set on a vibrant alien planet. Play as an interstellar custodian sent to clean up a polluted ocean planet. Repurpose marine debris and take care of axolotl-like alien creatures!

As you clean up the planet, you’ll run into axolotl-like aliens known as “loddles.” Protect them from the polluted waters and feed them aquatic fruits while you make their planet habitable again. Depending on their diet, loddles will grow in different ways and develop unique traits and abilities that will further enable them to survive on this polluted planet.",https://www.igdb.com/games/loddlenaut,80,1,,1,,,195826,195827,,,,,,,,130,,,,,,,,2,"Loddlenaut is a creature-raising survival game that takes place on an ocean planet. Play as an interstellar custodian who is sent to clean up an abandoned planet polluted by a mega-corporation as you get it ready for the next company to move in. Your mission: to clean up GUP-14, a small ocean planet that was once the home of GUPPI, a mega-corporation that makes and sells everything from soda to rockets. When you first arrive on the planet, you’ll find yourself amid murky waters, oil spills, and scattered junk. Within the polluted environments, you’ll find remnants of GUPPI’s buildings, ships, and machinery all sunken to the ocean floor. As you clean up their mess, explore these areas to discover clues about the company’s questionable past.",,,,,,,,,,,,,,,,,,,,,,,
Chop Goblins,225792,"2,467",52,"2,519",93.40%,225792,0,269738,1670803200,6,130,chop-goblins,"Pursue the malevolent Chop Goblins through time, and foil them with devastating weapons, in this bite-sized FPS from the creator of Dusk, Iron Lung, and Squirrel Stapler",https://www.igdb.com/games/chop-goblins,,,,1,,,194114,,,,,,,,,,,,,,,,,1,"You thought it would be fun to break into a nearby museum and root through the artifacts stored there. Little did you know that a dusty chest in the basement imprisoned the evil Chop Goblins.

Now they're loose, wrecking bladed havok on the world once again. It's up to you to chase them through the city and across space and time, in a bespoke FPS campaign spanning the modern day, 1800's Transylvania, ancient Greece, and the not too distant future.",,,,,,,,,,,,,,,,,,,,,,,
Cureocity,275979,"1,900",32,"1,932",93.39%,275979,0,342922,1711065600,6,,cureocity,"“People think battles need powerful weapons, but strategy at hand is key.""The story follows a rookie adventurer and a new healer in a dungeon quest, with the core gameplay involving hand-picked methods using weapons and items. Fight or purify? Heal or alter? The choice is in your hands.",https://www.igdb.com/games/cureocity,,,13,1,,,,,,,,,,,,,,,,,,,,,,34783,,,,,,,,,,,,,,,,,,,,,,
NEKOPARA Extra,106416,"3,620",98,"3,718",93.38%,106416,0,173726,1532649600,6,48,nekopara-extra,"About half a year before the opening of the patisserie, La Soleil where the catgirls work with Kashou.
Back when Chocola and Vanilla were still kittens when they first arrived at the Minaduki household and before they opened up to the other catgirls.
It's then that they gradually began to call Kashou ""master"", experienced their first Christmas, and shared a promise with Kashou.
This is an extra episode as part of a stretch goal from the Nekopara OVA crowdfunding campaign!",https://www.igdb.com/games/nekopara-extra,,,272,1,,,107745,107747,114562,,,,,,,130,372,,,,,,,1,"After being taken in by Kashou and his little sister, Shigure, the young kittens, Chocola and Vanilla find it difficult to fit in. Despite the warm welcome the other Minaduki catgirls give to them, they act with trepidation as they adjust to the pace of the family.

As they slowly interact with their fellow sister catgirls, Chocola and Vanilla begin to open up more and it's here we see Kashou's kindness towards them that builds up their feelings towards him.

Nekopara Extra is an extra episode in the series that was part of a stretch goal from the Nekopara OVA crowdfunding campaign. The lovable catgirls, Chocola and Vanilla, are back and this time the story focuses on their first arrival at the Minazuki household before the events of Nekopara Vol. 1.",11136,,,,,,,,,,,,,,,,,,,,,,
Killing Floor,2949,"63,025","3,356","66,381",93.36%,2949,0,130437,1242259200,3,6,killing-floor,Killing Floor is a Co-op Survival Horror FPS set in the devastated cities and countryside of England after a series of cloning experiments for the military goes horribly wrong. You and your friends are members of the military dropped into these locations with a simple mission: Survive long enough to cleanse the area of the failed experiments!,https://www.igdb.com/games/killing-floor,68,5,6,1,2,3,7209,,,,,1852,,,,14,,,,,,,,1,,19335,,,,,,,,,,,,,,,,,,,,,,
Fireworks Mania,126512,"5,539",182,"5,721",93.36%,126512,0,216396,1608163200,6,,fireworks-mania,"FIREWORKS MANIA is an small casual explosive simulator game where you can play around with fireworks, create beautiful firework shows or maybe just blow stuff up.",https://www.igdb.com/games/fireworks-mania,,,,1,,,112098,,,,,,,,,,,,,,,,,1,,,,,,,,,,,,,,,,,,,,,,,,
VVVVVV,1990,"9,410",365,"9,775",93.35%,1990,0,210472,1263168000,3,6,vvvvvv,"There's something terribly wrong in an alternate dimension! Help Captain Viridian flip to find five crew members, 20 hard-to-reach Trinkets and save a dimension on the brink of destruction. It's a space opera in the most unique scale with a style that only VVVVVV can bring to you. Instead of jumping, control the direction of gravity by inverting your gravity and allowing Captain Viridian to flip between the floors and ceilings of the environment.

For adventurers who save the dimension, there's still hours and hours of new gameplay with all-new Player Levels. Test your mettle and see if you have what it takes to beat a collection of levels created by other famous game developers.

Inspired by classic 8-bit days gone-by and now with experience-heightening 3D, VVVVVV will challenge even the most battle-hardened old-school gamers.",https://www.igdb.com/games/vvvvvv,79.75,6,,1,2,,164678,164679,164680,,,,,,,14,34,37,39,46,48,72,130,4,"A spaceship with six crew members - Viridian, Victoria, Vitellary, Vermillion, Verdigris, and Violet - suddenly encountered mysterious trouble while underway.
The group escapes by means of a teleportation device, but for some reason all the crew members are sent to different places.
Viridian, the protagonist, must find the other crew members and escape from this mysterious labyrinth...",,,,,,,,,,,,,,,,,,,,,,,
I commissioned some bees 0,211735,"4,111",120,"4,231",93.35%,211735,0,255516,1662595200,6,,i-commissioned-some-bees-0,"The brief was simple. Artists were commissioned to create a fantasy world, and hide as many bees as they can inside it. Now it’s your job to find them all! With 10 art pieces to choose from, and 1000+ bees, you will have a lot of searching to do.",https://www.igdb.com/games/i-commissioned-some-bees-0,,,,1,,,214853,,,,,,,,,,,,,,,,,,,,,,,,,,,,,,,,,,,,,,,,,
Disfigure,211502,"3,698",103,"3,801",93.34%,211502,0,293624,1690416000,6,,disfigure,Disfigure is a top-down shooter rogue-lite in which you fight countless grotesque creatures shrouded in darkness. Choose from a variety of upgrades to create unique builds each run and survive.,https://www.igdb.com/games/disfigure,,,,1,,,246615,,,,,,,,,,,,,,,,,,,,,,,,,,,,,,,,,,,,,,,,,
Garden Galaxy,199279,"1,953",35,"1,988",93.34%,199279,0,241802,1670976000,6,,garden-galaxy,"Discover, collect and organise to create your own unique garden in this relaxing idle / creative sandbox!",https://www.igdb.com/games/garden-galaxy,,,13,1,,,236661,,,,,,,,,,,,,,,,,3,,,,,,,,,,,,,,,,,,,,,,,,
eden*,6979,"4,092",120,"4,212",93.33%,6979,0,154687,724896000,19,58,e-v-o-search-for-eden--1,"The storyline of E.V.O.: Search for Eden follows the same patterns as modern Evolution theories. The players first controls a prehistoric sea organism, and fights to gain evolution points with which he can improve his fish's body parts and upgrade his attack/defense abilities. The gameplay is not completely linear, which means that certain choices of paths and stages will affect the player's success. The game is composed of a series of stages, in which the sea organism slowly evolves into an amphibian, and later a land-only creature. The physical changes are fairly scientifically accurate which gives the game a semi-educational purpose as well.",https://www.igdb.com/games/e-v-o-search-for-eden--1,,,,1,,,16504,114364,114365,114366,,,,,,,,,,,,,,4,"E.V.O. tells the saga of life's evolution on Earth, with a subtext of a creation myth and polytheistic evolution. The player takes the role of one of many billions of lifeforms created by Gaia, the nurturing and benevolent daughter of Sol, the Sun. Among the creatures known as life, there is a competition to evolve, and the best lifeform will eventually be granted the privilege of entering the Garden of Eden and becoming the husband and partner of Gaia. As the game progresses, it soon becomes apparent some mysterious external force is interfering with evolution on Earth in a destructive manner. Strange crystals not native to Gaia appear across the planet, and creatures that eat the crystals are transformed into monstrously powerful beings that dominate all other lifeforms, overconsume resources and disrupt the flow of evolution. In each Age the player character is tasked with confronting the species transformed by the crystals and defeating them so that the evolution of life can continue as intended.

In the final Age, the Age of Eden, the player learns a mysterious entity is controlling the world's other lifeforms and sending them against the player. This entity turns out to be Bolbox, a lifeform that has evolved into a freakish and evil advanced being by consuming the crystals, believing itself to be the first human, but in reality is a gigantic single-celled organism. In the game's final battle, the player and Bolbox fight to determine who will gain entry into Eden and become Gaia's partner. Bolbox is defeated, and the player joins Gaia in Eden and is granted the gift of intelligence. It is also revealed the crystals were introduced to Earth by an advanced civilization on Mars, who misguidedly wished to help Earth by speeding its evolution with the crystals. Upon realizing the dangers the crystals create, the Martians decide to leave Earth alone and observe until it becomes advanced enough for them to interact with.",4300,,,,,,,,,,,,,,,,,,,,,,
Sword and Fairy,78048,"3,424",92,"3,516",93.33%,78048,0,55003,978307200,6,,sword-and-fairy-inn,"Sword and Fairy Inn (Xianjian Kezhan) is based on the Chinese role-playing game Xianjian Qixia Zhuan. The game has the same protagonist, the young swordsman Li Xiaoyao, and is in a certain way a parody of Sword and Fairy. In this game, Li Xiaoyao still works for his aunt, doing various jobs in the inn. The game also features the female characters from the RPG - Li Xiaoyao's sweetheart Zhao Ling'er, Lin Yueru, and Anu.

Unlike most installments in the series, ""Sword and Fairy Inn"" is not a role-playing game, but a simulation. The player's goal in the game is to cook meals, prepare rooms, and generally take care of the guests. The game has an internal clock, and the hero should do his job well to please his aunt. When Li Xiaoyao is not busy with the inn, he can explore nearby locations or have a date with Ling'er. There are many items to be found, which can be later used for cooking and other purposes. The game has pre-rendered backgrounds and ""super-deformed"" graphics for characters.",https://www.igdb.com/games/sword-and-fairy-inn,,,,1,,,59188,,,,,,,,,,,,,,,,,,,,,,,,,,,,,,,,,,,,,,,,,
Zup! X,101515,"6,291",219,"6,510",93.32%,101515,0,105234,1526515200,6,,zup-x,Minimal physical puzzle with explosions,https://www.igdb.com/games/zup-x,,,,1,,,67173,,,,,,,,,,,,,,,,,,,,,,,,,,,,,,,,,,,,,,,,,
枝江往事,155549,"4,750",149,"4,899",93.32%,155549,0,245424,1623369600,6,14,zhi-jiang-wang-shi,,https://www.igdb.com/games/zhi-jiang-wang-shi,,,,,,,,,,,,,,,,,,,,,,,,,,,,,,,,,,,,,,,,,,,,,,,,
Don't Escape: 4 Days to Survive,55812,"2,056",39,"2,095",93.32%,55812,0,73937,1552262400,6,14,dont-escape-4-days-to-survive,"After scraping out a bleak existence in the post-apocalyptic wastelands, you thought you were prepared for anything. But now there’s no way to run. The choices you make determine how everything plays out in this classic point-and-click adventure.",https://www.igdb.com/games/dont-escape-4-days-to-survive,,,13,1,,,170182,170183,,,,,,,,,,,,,,,,4,"Following a bizarre cataclysmic event that cracked the moon in half, the Earth is struggling with the environmental fallout. Everything is already dead or dying... except you. Or so you think. Players must figure out a way to properly fortify their home against each night's new danger, as they learn the truth behind the apocalypse and search for a way to safety, if one exists.

Players will journey alongside David, a lone survivor after the end of the world, who finds himself having prophetic dreams... or nightmares. Each chapter of the game has multiple potential variations to encounter, from poisonous fog or spiders to a gang of murderous thugs or a deadly heat wave, and as a result, you'll need to adjust your strategy on different playthroughs. But you don't have forever. Certain actions advance the in-game clock, and you'll need to complete your preparations to (hopefully) stay alive before night falls.

Will you make it through all four days? Will your companions?",,,,,,,,,,,,,,,,,,,,,,,
The Room Three,18222,"10,872",443,"11,315",93.31%,18222,0,134100,1446595200,6,34,the-room-three,"Lured to a remote island, you find yourself confined within the rooms of an ominous mansion. You must draw upon all your puzzle-solving ability to navigate a series of trials devised by a mysterious figure known only as “The Craftsman”. Do you have what it takes to escape?",https://www.igdb.com/games/the-room-three,,,13,1,,,207122,,,,,,,,,39,,,,,,,,1,,,,,,,,,,,,,,,,,,,,,,,,
Endless Monday: Dreams and Deadlines,236360,"1,203",11,"1,214",93.31%,236360,0,314956,1683158400,3,6,endless-monday-dreams-and-deadlines,"""Endless Monday: Dreams and Deadlines"" - In this short branching visual novel story, Penny, a mild-mannered corporate grunt, pulls an all-nighter at the office in an effort to finish her project on time while overcoming distractions from coworkers, space aliens, imaginary friends, and herself.",https://www.igdb.com/games/endless-monday-dreams-and-deadlines,,,,1,,,223366,,,,,,,,,,,,,,,,,1,,,,,,,,,,,,,,,2,5,,,,,,,,
Rabi-Ribi,28545,"11,137",458,"11,595",93.30%,28545,0,205220,1453939200,6,46,rabi-ribi,"Dodge bullets, missiles and lasers in battle as you wrap your head around that bunny girl costume! Combo away with your mighty Piko Hammer or spam various spells from afar with your fiery fairy friend. Explore and explode through Rabi-Rabi Island as you collect power-ups and uncover secrets...",https://www.igdb.com/games/rabi-ribi,85.25,4,,1,,,57093,57095,130835,193592,193593,,,,,48,130,,,,,,,4,"The main character is Erina, formerly a normal rabbit who became transformed into a human bunny girl, and awakens in an unknown place. Shortly after she is magically sent back to Rabi Rabi Island, her home island. Lost and confused, searching for her master is the best thing to understand what's going on. Along the way, Erina befriends Ribbon, a fairy seeking freedom and independence and becomes Erina's sidekick.",2902,,,,193594,,,,,,,,,,,,,,,,,,
Hypnospace Outlaw,99071,"4,320",131,"4,451",93.30%,99071,0,112950,1552348800,3,6,hypnospace-outlaw,"Hypnospace Outlaw is a '90s internet simulator in which players act as Enforcers, volunteer moderators who scour Hypnospace's surreal network of weird and wonderful websites to hunt down wrongdoers while also keeping an eye on their inbox, avoiding viruses and adware, and downloading a plethora of apps that may or may not be useful.",https://www.igdb.com/games/hypnospace-outlaw,84.33333333333333,6,206,1,,,120366,120367,120368,120369,,,,,,14,48,49,130,,,,,,"Greetings Enforcer, and thank you for enlisting in the Hypnospace Patrol Department! As the world falls into its slumber, Hypnospace becomes a bustling global village. These virtual streets aren't going to police themselves!

As part of your job as a Hypnospace Enforcer, you'll be watching out for copyright infringement, internet bullying and more, with reports and rewards coming direct from the Hypnospace Patrol Department to your inbox. In your spare time, you can customize your HypnOS desktop however you see fit, with a variety of downloads, wallpapers, screen savers and helper bots to keep you company.",,,,,,,,,,,,,,,,,,,,,,,
Trine,6250,"14,329",625,"14,954",93.28%,6250,0,101059,1323216000,3,6,trine-2,"Three Heroes survive in countless dangers in a fairy-tale world, with physics-based jigsaw puzzles, beautiful scenery, and cooperative online mode.",https://www.igdb.com/games/trine-2,85,9,,1,2,3,14891,46515,,,,596,7602,,,9,12,14,34,41,,,,4,,4078,,,,,,,,,,,,,,,,,,,,,,
ANIMAL WELL,191435,"13,076",560,"13,636",93.28%,191435,0,209141,1715212800,6,130,animal-well,"What lurks beneath the surface of this deceptively minimalistic adventure? In Animal Well there is more than what you see. Explore a dense interconnected labyrinth, and unravel its many secrets. Collect items to manipulate your environment in surprising and meaningful ways. Encounter creatures both beautiful and unsettling, and try to survive what lurks in the dark.",https://www.igdb.com/games/animal-well,89,5,149,1,,,199080,199081,,,,,,,,167,,,,,,,,4,"It is dark. It is lonely. You don't belong in this world. It's not that it’s a hostile world... it's just... not yours. As you uncover its secrets, the world grows on you. It takes on a feel of familiarity, yet you know that you've only probed the surface. The more you discover, the more you realize how much more there is to discover. Secrets leading to more secrets. You recall the feeling of zooming closer and closer in on a very high-resolution photo. As you hone your focus, the world betrays its secrets.",,,,,,,,,,,,,,,,,,,,,,,
Insaniquarium! Deluxe,8323,"5,236",173,"5,409",93.28%,8323,0,271917,1093996800,6,,insaniquarium-deluxe--1,"Dive into wild arcade action as you feed fish and fight aliens in the craziest aquarium around! Control and protect a colorful aquarium with fantastic fish and colorful sea creatures by keeping your friendly fish fed and happy... and safe from alien intruders!
Feed your fish, then quickly collect the coins they drop to upgrade to better food, amazing new fish species and awesome weapons. But make sure to use those weapons on all the ruthless extraterrestrial boss beasts, or you'll be sunk in an empty tank!",https://www.igdb.com/games/insaniquarium-deluxe--1,,,,1,,,20373,20374,,,,,,,,,,,,,,,,4,,,,,,,,,,,,,,,,,,,,,,,,
Hexcells Infinite,11061,"4,154",125,"4,279",93.28%,11061,0,98797,1409529600,3,6,hexcells-infinite,"Hexcells Infinite is the third game in the series of ambient logic puzzle games.
It includes a new set of 36 puzzles as well as a random puzzle generator and now supports mid-level saving.",https://www.igdb.com/games/hexcells-infinite,,,404,1,,,125518,,,,,,,,,14,39,,,,,,,1,,,,,,,,,,,,,,,,,,,,,,,,
NUKITASHI 2,207209,"1,353",16,"1,369",93.28%,207209,0,347003,1707955200,6,,nukitashi-2--1,A new battle begins for Junnosuke—backed by the FS Big Three! “This is what it truly means for the minority to get vengeance.”,https://www.igdb.com/games/nukitashi-2--1,,,,1,,,243139,243140,,,,,,,,,,,,,,,,,"It all happened after the grand adventure that was NUKITASHI...

The war is over, and Junnosuke Tachibana, savior of Seiran Island, spends his days with his buddies reminiscing over victories past. True coexistence has now been achieved, and peace will continue for years to come—or so he believes.

One fateful day, a grave data-related incident results in him breaking through the speed of light, transporting Junnosuke and his friends to a parallel world.",,,,,,,,,,,,,,,,,,,,,,,
Orbo's Odyssey,260493,"1,189",11,"1,200",93.28%,260493,0,322034,1692576000,6,,orbos-odyssey,"Orbo Stetson is just your average personal assistant. He files documents, he drafts up risk mitigation plans for new products, and he can launch himself like a .50 caliber bullet when prompted. On this fateful day, however, Orbo and his coworker Peeb find themselves in a bit of a predicament... The automatic door opener has been fried, and with the duo lacking a single arm between them, they are now trapped in their Boss's office. It's up to Orbo to scrounge up enough gear parts across 4 unique product portals to engineer a prosethetic arm so that he and Peeb may finally open the door and escape from this unsavory work environment...",https://www.igdb.com/games/orbos-odyssey,,,13,1,,,225952,,,,,,,,,,,,,,,,,2,,,,,,,,,,,,,,,,,,,,,,,,
Mirage Feathers,279938,"1,122",9,"1,131",93.28%,279938,0,411752,1725580800,6,,mirage-feathers,"Maybe one day, I won't have to fight when I fly.",https://www.igdb.com/games/mirage-feathers,,,,1,,,287297,,,,,,,,,,,,,,,,,2,,,,,,,,,,,,,,,,,,,,,,,,
FreshWomen - Season 1,215301,"15,990",715,"16,705",93.27%,215301,0,242949,1660867200,3,6,freshwomen,"FreshWomen is a choice-driven adult Visual Novel focusing on the best parts of life. Become a freshman attending Minerva Bay College, romance girls and solve a mysterious incident. Your journey will be filled with comedy, drama, and lots of sex.",https://www.igdb.com/games/freshwomen,,,179,1,,,186847,,,,,,,,,34,,,,,,,,,"You’re a young man trying to find out what happened to your father. But in doing so, you ended up having an accident that erased some of your memories. Now, with a clean slate, you moved to another town to start college. In your freshman life, you will meet several girls in a new world filled with fun, mystery, and sex.",,,,,,,,,,,,,,,,,,,,,,,
Spin Rhythm XD,122416,"3,794",110,"3,904",93.27%,122416,0,292213,1678752000,6,130,spin-rhythm-xd,"Enter the Rhythm Dimension! A homage to classic arcade rhythm games, with a modern aesthetic and soundtrack. Match colours and beats, spin, tap, flick and flow through the juiciest beats in the universe. Supports multiple control styles including Midi DJ gear on Steam!",https://www.igdb.com/games/spin-rhythm-xd,98,1,13,1,2,,84874,,,,,,,,,167,390,,,,,,,2,,,,,,,,,,,,,,,,,,,,,,,,
Zup! Z,168955,"4,013",120,"4,133",93.26%,168955,0,208657,1608508800,6,,zup-z,Minimal physical puzzle with explosions,https://www.igdb.com/games/zup-z,,,,,,,,,,,,,,,,,,,,,,,,,,,,,,,,,,,,,,,,,,,,,,,,
The Elder Scrolls III: Morrowind,56,"23,604","1,139","24,743",93.24%,56,0,120073,1020211200,6,11,the-elder-scrolls-iii-morrowind,"First-person WRPG and third mainline entry in the Elder Scrolls franchise in which the player arrives in the island of Vvardenfell, an exotic land plagued by disease-carrying storms and ruled by a godly Tribunal, in the Morrowind province of Tamriel, and takes part in the prophecy foretelling the second coming of Nerevar, who will supposedly save Morrowind from malicious clans both within and outside Vvardenfell.",https://www.igdb.com/games/the-elder-scrolls-iii-morrowind,63.25,4,54,1,,,3294,3296,95348,,,,,,,,,,,,,,,1,,32196,,,,,,,,,,,,,2,,,,,,,,,
Coloring Pixels,105847,"7,081",263,"7,344",93.24%,105847,0,,,,,pixel-artist-color-number-pixel-coloring-book,,https://www.igdb.com/games/pixel-artist-color-number-pixel-coloring-book,,,,,,,,,,,,,,,,,,,,,,,,,,,,,,,,,,,,,,,,,,,,,,,,
Neighbours from Hell,3132,"2,777",69,"2,846",93.24%,3132,0,357232,1056067200,6,11,neighbours-from-hell--1,"Woody is an average man who has a happy life, until his neighbor Mr. Rottweiler, makes his life miserable. So Woody decides to take full revenge on Mr. Rottweiler, becoming the star of a new TV show where he performs tricks on his unsuspecting neighbour, setting traps in his house such as sawing the chair, banana peels/soap on the floor, smeared paintings and messing with home equipment. Create disarray, increase ratings, and win awards as you make a living hell out of the neighbour's life!",https://www.igdb.com/games/neighbours-from-hell--1,72,2,,1,,,7990,8017,,,,,,,,21,,,,,,,,4,"Woody is an average man who has a happy life, until his neighbor Mr. Rottweiler, makes his life miserable. Woody decides to take full revenge on Mr. Rottweiler. In the game Neighbors from Hell, the player creeps around the neighbour’s house performing tricks upon the unsuspecting resident. The player is the star of a new TV show with the same name, with cameras that track every move as the player sets traps such as sawing the chair, banana peels/soap on the floor, smeared paintings and messing with home equipment. The game's objectives are to create disarray, increase ratings, and win awards. Obstacles in the game include the watchful neighbour himself, also - his guard dog, and a parrot called Chilli, both of whom will try to alert the Neighbour of Woody's presence.",30860,,,,,,,,,,,,,,,,,,,,,,
