Sekiro™: Shadows Die Twice,76882,"286,145","14,075","300,220",94.29%,76882,0,106347,1553212800,6,48,sekiro-shadows-die-twice,"Enter a dark and brutal new gameplay experience from the creators of Bloodborne and the Dark Souls series. Sekiro: Shadows Die Twice is an intense, third-person, action-adventure set against the bloody backdrop of 14th-century Japan. Step into the role of a disgraced warrior brought back from the brink of death whose mission is to rescue his master and exact revenge on his arch nemesis.

Take Revenge. Restore Your Honor. Kill Ingeniously.",https://www.igdb.com/games/sekiro-shadows-die-twice,90.0909090909091,17,,1,,,112950,112951,,,,,,,,49,170,,,,,,,2,"The game takes place in a re-imagined late 16th century Sengoku period Japan. At the end of the Sengoku era, warlord Isshin Ashina stages a bloody coup and seizes the land of Ashina. During this time, a nameless orphan is adopted by the wandering shinobi Owl, who names the orphan ""Wolf"".

Twenty years later, the Ashina clan are on the brink of collapse due to a combination of the now elderly Isshin having fallen ill and the clan's enemies steadily closing in from all sides. Desperate to find a way to prevent the fall of his clan, Isshin's grandson Genichiro captures the Divine Heir Kuro, in hopes of using his ""Dragon Heritage"" to create an immortal army.",1879,,,,,,,,,,,,,,,,,,,,,,
NEKOPARA Vol. 4,35254,"8,230",219,"8,449",94.29%,35254,0,120397,1606348800,6,48,nekopara-vol-4,"Despite the popularity of, ""La Soleil"", Kashou's father continues to disapprove of it. Determined to get his father to approve of him, Kashou journeys to France to seek advice from the teacher who taught him his craft. A new chapter awaits in the next volume of the Nekopara series!",https://www.igdb.com/games/nekopara-vol-4,,,272,1,,,107733,112256,112257,129800,,,,,,130,,,,,,,,5,"Despite the popularity of Kashou Minaduki's patisserie, ""La Soleil"", his father continues to disapprove of it.

Seeing how troubled Kashou was, Shigure offers up a suggestion as a change of pace.
A hot springs trip with Chocola, Vanilla and the other catpanions.
With Azuki and Coconut's encouragement, Kashou is determined to confront his father while Maple and Cinnamon suggest a trip to France to seek advice from the teacher who taught him his craft.

But why is Shigure also tagging along!?

And an encounter with a new catgirl in France...

This story is a heartwarming cat comedy about the growth Kashou experiences through his catpanions and the bonds with them and his family... with a little ecchi on the side, too.",6716,,,,,,,,,,,,,,,,,,,,,,
Peggle Deluxe,28975,"8,887",245,"9,132",94.28%,28975,0,115701,1173139200,6,14,peggle-deluxe,"Take your best shot with energizing arcade fun! Aim, shoot, clear the orange pegs, then sit back and cheer as 10 whimsical teachers guide you to Peggle greatness. Conquer 55 fanciful levels with 10 mystical Magic Powers, racking up bonus points and shots you'll smile about for weeks. Face off against your friends in Duel Mode, or tackle 75 extra-tricky challenges. It's luck and skill and joyous thrills, and amidst all this fevered action only one question remains: Can you become a Peggle Master?",https://www.igdb.com/games/peggle-deluxe,,,,1,,,98103,,,,,,,,,,,,,,,,,,,,,,,,,,,,,,,,,,,,,,,,,
Dying Light,3042,"409,692","20,754","430,446",94.27%,3042,0,287666,1422230400,3,6,dying-light,"Dying Light is a first-person, action survival horror game set in a vast and dangerous open world. During the day, players traverse an expansive urban environment overrun by a vicious outbreak, scavenging the world for supplies and crafting weapons to defend against the growing infected population. At night, the hunter becomes the hunted, as the infected become aggressive and more dangerous. Most frightening are the predators which only appear after sundown. Players must use everything in their power to survive until the morning’s first light.",https://www.igdb.com/games/dying-light,72.05882352941177,20,78,1,2,3,24519,24520,70716,,,7734,15182,20068,,9,12,14,48,49,,,,1,"In the city of Harran, a mysterious viral outbreak has turned most of the population into hyper-aggressive zombie-like creatures, forcing Harran's Defense Ministry to quarantine the entire city. The Global Relief Effort (GRE) assists survivors still trapped in the city by regularly airdropping supplies. The GRE hires Kyle Crane to infiltrate Harran in order to retrieve a sensitive file stolen from them by Kadir Suleiman, which he is using as leverage to blackmail them, with the threat of publicizing it if anything were to happen to him. Crane is airdropped into Harran, where he is ambushed by a gang of hostile bandits. As the infected attack, Crane is bitten and infected, but rescued by Jade Aldemir and Amir Ghoreyshi. Amir sacrifices himself to buy Jade and Crane time, and Jade takes him to a survivor sanctuary called the Tower. Crane wakes up and is introduced to Rahim Aldemir, Jade's brother. Rahim then teaches Crane parkour and sends him to Spike, who gives him his first task as a resident of the tower. Crane learns that the Tower, which seeks to help other survivors, is being harassed by a gang of bandits led by a warlord named Rais who steals and hoards the supplies from the GRE airdrops, including Antizin; a vaccine that suppresses symptoms of infection and keeps bitten people from turning into the infected. After Harris Brecken, leader of the tower is nearly killed by a rival runner in a mission to retrieve an Antizin drop, need for the drug becomes immense. Crane volunteers and manages to reach an airdrop containing Antizin, but despite the dire need of the vaccine by the survivors, Crane is instructed by the GRE to destroy the airdrop, instructing him to reach out to Rais in order to buy the vaccine in order to confirm his identity. Crane reluctantly complies and informs the Tower that the supplies have been looted.

Upset, Brecken tasks Crane with the job of making a deal with Rais. Upon meeting Rais, Crane is able to confirm that he is indeed Suleiman. He carries out a series of unethical tasks for Rais under the assumption that he will be rewarded with two crates of Antizin. Crane is unable to locate the file, and is later betrayed by Rais, who only gives him five vials of Antizin. He later breaks off business with the GRE when they halt the supply drops and refuse to help the Tower. The situation in the tower worsens, and a whole floor is sealed off when an outbreak occurs. While doing an errand, Rahim tells Crane that he and Omar were planning to bomb an infected nest. Crane is opposed to this plan. After an argument over the radio, he gives chase to a fleeing Rahim. Upon catching up to him, he finds that Omar is dead, while Rahim has been wounded. He then executes Rahim's plans, resulting in the killing of the infected in the compound. When he gets back to Rahim he discovers that he was actually bitten and had turned while Crane was gone, forcing Crane to respectfully snap Rahim's neck when he attacks him. When Crane returns to the tower to inform Brecken of the news, Jade overhears them, and visibly upset, takes off.

Meanwhile, a scientist at the Tower named Dr. Imran Zere, who was attempting to develop a cure for the virus, is kidnapped by Rais, prompting Crane to attempt a rescue mission. Crane is also captured by Rais, who reveals that the file he stole contains proof that the GRE intends to weaponize the virus rather than develop a cure and releases the file to the public. Crane manages to escape before being executed, resulting in Rais losing one of his hands during the process. Dr. Zere is killed in the rescue attempt, but manages to tell Crane that he had entrusted his research to Jade, who is tasked with delivering it to another scientist named Dr. Allen Camden. As Crane goes to look for Jade, he finds out that the Defense Ministry is planning to bomb Harran in an effort to completely eradicate the outbreak, claiming that there are no survivors left in the city. He manages to reactivate a radio tower and broadcasts a message to the outside world, thwarting the Ministry's plan. Jade was captured by Rais, who also steals Dr. Zere's research. Crane manages to rescue Jade and recover a part of Dr. Zere's research, but Jade admits that she has been bitten, and pleads with Crane to stop Rais. Jade then succumbs to the wound, forcing Crane to kill her. After killing Rais' assistant, Tair with his own machete, Crane delivers the tissue samples to Dr. Camden, who believes that he is very close to the cure, but needs the rest of Dr. Zere's data. Crane then finds out that Rais has cut a deal with the GRE, in which he will hand over Dr. Zere's research data to them in return for extraction from Harran. Crane then assaults Rais' headquarters (filled with infected) and battles him atop a skyscraper, eventually stabbing Rais in the neck and throwing him off the building. He recovers the research data and decides to turn it over to Dr. Camden instead of the GRE, intending to stay in Harran to help the survivors.",,,,,,,,,,,,,,,,,,,,,,,
DOOM,121503,"185,890","8,893","194,783",94.27%,121503,9,322240,1564099200,6,34,doom-ii,"Celebrate Doom's 25th anniversary with the re-release of Doom II. This beloved sequel to the groundbreaking Doom (1993) gave players the brutal Super Shotgun to bear against deadlier demons, and the infamous boss, the Icon of Sin.

The re-release of DOOM II includes:
- The Master Levels, 20 additional levels made by the community and supervised by the developers
- Local 4 player multiplayer
- Local 4 player co-op

To save Earth, you must descend into the depths of hell, survive demon hordes, and take part in the fiercest battle ever.",https://www.igdb.com/games/doom-ii,,,,1,2,3,226867,226868,226869,,,24266,,,,39,48,49,130,,,,,1,,,,,,,,,,,,,,,,,,,,,,,,
Tiny Bunny,131653,"17,999",616,"18,615",94.27%,131653,0,93882,1618531200,6,,tiny-bunny,"Tiny Bunny is a non-linear horror visual novel. Those, who have heard the voice of the forest, are beyond help.",https://www.igdb.com/games/tiny-bunny,,,,1,,,166734,166735,166736,,,,,,,,,,,,,,,4,"The story takes place in a quiet, unremarkable village lost among the Siberian forest. The protagonist, Anton, had recently moved there with his family and was almost immediately forced to witness and participate in a chain of unsettling events.
It's a place where children go missing. The police are powerless, search teams are combing out the forest, but they find no traces. Why, then, is Anton repeatedly coming across prints, bloodstains, and scraps of clothing? It almost feels like someone is putting up a show just for him.
He is haunted by nightmares at first, which grow more and more frightening and bloody every night. They also grow increasingly real ... and beckoning.",,,,4,,,,,,,,,,5,,,,,,,,,
BAD END THEATER,178264,"7,243",185,"7,428",94.26%,178264,0,193036,1635206400,3,6,bad-end-theater,"Welcome to Bad End Theater! Select your protagonist and explore a variety of terrible fates! The decisions you make in one story will affect the others. you can toggle these behaviors to open up new paths! unfortunately, every path leads to a bad ending... Can you find a way to save this unlucky cast? Playtime: 2-3 hours to see all endings (it's a puzzle game, so this varies widely).",https://www.igdb.com/games/bad-end-theater,,,,1,,,154709,,,,,,,,,14,34,,,,,,,2,,1135,,,,,,,,,,,,,5,,,,,,,,,
Your Only Move Is HUSTLE,225590,"24,389",899,"25,288",94.25%,225590,0,347088,1675382400,3,6,your-only-move-is-hustle,"Your Only Move Is Hustle is an online, turn-based fighting game and superpowered fight scene simulator. Using a unique and accessible control scheme, harness the power of precognition to land the perfect blow. Master your technique, execute flashy combos, and outsmart opponents across the world, frame-by-frame.",https://www.igdb.com/games/your-only-move-is-hustle,,,456,1,2,,207207,,,,,,,,,,,,,,,,,4,,,,,,,,,,,,,,,,,,,,,,,,
The Test: Hypothesis Rising,132660,"5,665",129,"5,794",94.25%,132660,0,191986,1587945600,6,,the-test-hypothesis-rising,"The second chapter in The Test trilogy. Answer a series of in-depth questions to reveal hidden truths about yourself and unlock secrets to discover how your life can change drastically with just a few, slight modifications. ...But are you sure you want the answers you seek?",https://www.igdb.com/games/the-test-hypothesis-rising,,,,1,,,179325,,,,,,,,,,,,,,,,,3,,,,,,,,,,,,,,,,,,,,,,,,
Aokana - Four Rhythms Across the Blue,54630,"5,160",112,"5,272",94.25%,54630,0,130938,1456358400,6,34,aokana-four-rhythms-across-the-blue,"Aokana: Four Rhythm Across the Blue is a romance visual novel in which the player assumes the role of Masaya Hinata. Much of its gameplay is spent on reading the story's narrative and dialogue. The text in the game is accompanied by character sprites, which represent who Masaya is talking to, over background art. Throughout the game, the player encounters CG artwork at certain points in the story, which take the place of the background art and character sprites. The game follows a branching plot line with multiple endings, and depending on the decisions that the player makes during the game, the plot will progress in a specific direction.",https://www.igdb.com/games/aokana-four-rhythms-across-the-blue,70,2,746,1,,,85572,85573,85574,85575,93640,,,,,39,46,48,130,,,,,5,"In a world where flying through the sky is as simple as riding a bicycle, the sport ""Flying Circus"" is all the rage.

Following the discovery of anti-gravitons, special shoes that allow an individual to fly, Anti-Graviton Shoes, took the world by storm.

And with the Grav Shoes came an entire new world for people to explore. Not long after, that revolution in technology gave birth to a brand new sport, Flying Circus, which used the shoes to make players compete in the open sky.

Masaya Hinata, who was once considered a prodigy, turned his back on Flying Circus after suffering a crushing defeat, although there was also another reason...

However, his former passion is reignited while teaching the new transfer student, Asuka Kurashina, how to fly.

This time, Masaya chooses to enter the world of Flying Circus not as a player, but a coach. Sometimes fighting, and at other times encouraging each other, he and his team decide to challenge the top student athletes in Japan.

Now, with Asuka by his side, how high will he be able to fly?

This is a love story about those who met through the sky, as well as the friends who surround them.",8312,,,,93641,,,,,,,,,,,,,,,136793,,,
The Walking Dead: The Telltale Definitive Series,117514,"22,041",797,"22,838",94.24%,117514,3,340752,1568073600,6,48,the-walking-dead-the-telltale-definitive-series,"The Walking Dead: The Telltale Definitive Series contains all 4 Seasons and The Walking Dead: Michonne, which includes over 50 hours of gameplay across 23 unique episodes. With graphical enhancements, behind the scenes bonus features and faithful recreations of classic menus, this is the definitive way to experience Clementine's journey and find out how her story ends.",https://www.igdb.com/games/the-walking-dead-the-telltale-definitive-series,75,3,,1,,,77725,,,,,,,,,49,,,,,,,,2,,,,,,,,,,,,,,,,,,,,,,,,
Samsara Room,300426,"8,380",229,"8,609",94.24%,300426,0,,1378339200,82,,samsara-room--1,"Samsara Room is the first game created by the Rusty Lake developers, released in September 2013. It is the precursor for the Cube Escape series, and contains similar puzzles that have been carried into the Rusty Lake games.",https://www.igdb.com/games/samsara-room--1,,,,1,,,265708,,,,,,,,,,,,,,,,,1,,,,,,,,,,,,,,,,,75123,,,,,,,
Kindergarten 2,290175,"4,434",88,"4,522",94.24%,290175,0,366919,1425945600,6,,kindergarten-2-daddy,"""I don't know what happened there...
Since I was there I keep hearing strange voices
in my head.
The sounds are like some children's laugh,
and sometimes they keep saying:
""Help us""
I don't know what's going on, but I
must find it out before I get mad.""",https://www.igdb.com/games/kindergarten-2-daddy,,,,,,,257165,,,,,,,,,,,,,,,,,,,,,,,,,,,,,,,,,,,,,,,,,
Resident Evil Village,142813,"106,413","4,895","111,308",94.22%,142813,3,125672,1620345600,6,48,resident-evil-village-and-resident-evil-7-complete-bundle,"Experience survival horror like never before in this bundle containing the definitive version of Resident Evil 7 biohazard, and Resident Evil Village, the 8th major installment in the franchise. With detailed graphics, intense first-person action and masterful storytelling, the terror has never felt more real in this heart-pounding narrative of family tragedy.

This pack includes the following content:
• Resident Evil 7 biohazard Gold Edition
• Resident Evil Village
• Resident Evil Re:Verse
• Trauma Pack",https://www.igdb.com/games/resident-evil-village-and-resident-evil-7-complete-bundle,,,354,1,,,117813,,,,,,,,,49,167,169,,,,,,1,,,,,,,,,,,,,,,,,,,,,,,,
Handshakes,231165,"2,375",26,"2,401",94.22%,231165,0,281902,1655596800,3,6,handshakes,"Take your brain for a walk in Handshakes, a simple yet tricksy sokoban puzzle game. Guide two hands through puzzles designed to stump, not frustate, so that they may achieve their dream of a warm, firm handshake.",https://www.igdb.com/games/handshakes,,,,1,3,,,,,,,,,,,14,82,,,,,,,4,,,,,,,,,,,,,,,,,,,,,,,,
Unheard,109148,"29,184","1,127","30,311",94.21%,109148,0,101431,1553817600,6,14,unheard,"Unheard is a narrative-centric detective game.
Put on your headphones and step back into the past. Use the voices you hear to return to crime scenes, tracking down each individual involved and solving the cases!
The game puts players in the role of a time-traveling detective who is only able to use one sense, sound. Also, the game’s story is a non-linear experience. Players must build their own timelines from the clues in conversations they overhear.",https://www.igdb.com/games/unheard,65,1,13,1,,,249689,249690,249691,,,,,,,34,39,48,49,130,,,,3,"Step through time as you use our device to eavesdrop on conversations from past crime scenes. Every clue, every move, and every motive will be presented in the form of audio. Rather than controlling any one character, you only need listen to their conversations, following along as the story evolves. Use the information you hear to match names to voices and determine how everything (and everyone) is related. Can you discover the truth?",27357,,,,,,,,,,,,,6,,,,,,,,,
Bopl Battle,244167,"12,291",388,"12,679",94.21%,244167,0,304156,1700092800,6,,bopl-battle,"A couch/online game where you battle your friends with unique and wild abilities. There are many choices such as a shrink ray, creating black holes, stopping time and attaching a rocket engine to the stage to send it flying. Choose a combination that synergizes well to win the round!",https://www.igdb.com/games/bopl-battle,,,,1,2,3,216154,216155,,,,,,,,,,,,,,,,4,,,,,,,,,,,,,,,,,,,,,,,,
NEKOPARA Vol. 3,29271,"11,474",354,"11,828",94.21%,29271,0,173730,1495670400,6,48,nekopara-vol-3,"Patisserie ""La Soleil"", run by Kashou Minaduki, is flourishing thanks to the help of two catgirls: Maple, full of pride and a little on the haughty side, and Cinnamon, an impulsive daydreamer.",https://www.igdb.com/games/nekopara-vol-3,85,2,824,1,,,87715,107737,107738,129802,,,,,,130,,,,,,,,5,"Patisserie ""La Soleil"", run by Kashou Minazuki, is flourishing thanks to the help of two catgirls: Maple, full of pride and a little on the haughty side, and Cinnamon, an impulsive daydreamer.

These two are especially close among among the rest of the sisters. One day, Maple encounters something that shakes her belief in attaining her dream. Cinnamon, unwilling to see Maple suffer, wishes to help her in any way possible... but she can't figure out how. This story is a heartwarming cat comedy about their ambitions and the bonds between family members... with a little ecchi on the side, too.",6597,,,,,,,,,,,,,,,,,,,,,,
Marco & The Galaxy Dragon,128160,"6,497",162,"6,659",94.21%,128160,0,230409,1582848000,6,130,marco-and-the-galaxy-dragon,"Marco, an orphan with missing memories, and Arco, a dragon who rules the galaxy, were hunting for treasure in space! On one of their adventures, Marco was given a clue to the whereabouts of her mother. Their next stop, her birthplace - Earth!",https://www.igdb.com/games/marco-and-the-galaxy-dragon,,,,1,,,90133,90134,,,,,,,,,,,,,,,,,,23547,,,,,,,,,,,,,,,,,,,,,,
Fallen Aces,152263,"4,382",88,"4,470",94.21%,152263,0,152722,1718323200,6,,fallen-aces,"The A.C.E.S. Watchful guardians of Switchblade City. Being taken down, one by one. Now it's up to one man, with two fists, to get to the bottom of it all. Fallen Aces is a crime noir FPS that plays right out of the '90s and looks right out of the comics.",https://www.igdb.com/games/fallen-aces,,,13,1,,,138988,138989,138990,,,,,,,,,,,,,,,1,,,,,,,,,,,,,,,,,,,,,,,,
Enter the Gungeon,11182,"77,683","3,491","81,174",94.18%,11182,0,82132,1459814400,3,6,enter-the-gungeon,"Enter the Gungeon is a gunfight dungeon crawler following a band of regretful misfits seeking to shoot, loot, dodge roll and table-flip their way to personal absolution by reaching the legendary Gungeon’s ultimate treasure: the gun that can kill the past. Select a hero and battle your way to the bot¬tom of the Gungeon by surviving a challenging and evolving series of floors filled with the dangerously adorable Gundead and fearsome Gungeon bosses armed to the teeth. Gather precious loot, discover hidden secrets, and chat with opportunistic merchants and shopkeepers to purchase powerful items to gain an edge.",https://www.igdb.com/games/enter-the-gungeon,82.46153846153847,16,13,1,2,3,128673,128674,290022,,,4172,10491,,,14,48,49,130,170,,,,3,,4868,24461,,,,,,,,,,,,,,,,,,,,,
The Planet Crafter,317867,"39,981","1,644","41,625",94.18%,317867,1,413466,1728432000,6,,the-planet-crafter-planet-humble,"Experience a fresh start as a Planet Crafter on the brand new world of Planet Humble!
Alone or with friends, scout this unknown land, discover its story, novelties and secrets and accomplish once again the task to terraform an entire world!",https://www.igdb.com/games/the-planet-crafter-planet-humble,,,,1,2,3,288663,,,,,30434,,,,,,,,,,,,1,,,,,,,,,,,,,,,,,,,,,,,,
Milo and the Magpies,139600,"2,864",41,"2,905",94.18%,139600,0,117850,1630972800,6,14,milo-and-the-magpies,"Milo and the Magpies is a point-and-click, hidden object game following the story of a little cat named Milo who is trying to find his way home after getting turned around by an unfortunate encounter with some pesky magpies.",https://www.igdb.com/games/milo-and-the-magpies,,,,1,,,157307,157308,,,,,,,,39,,,,,,,,,,,,,,,,,,,,,,,,,,,,,,,,
Monster Prom 3: Monster Roadtrip,198860,"2,828",40,"2,868",94.18%,198860,0,329246,1666310400,3,6,monster-prom-3-monster-roadtrip,"Embark on a road trip like no other in this co-op narrative survival adventure. Visit fun locations, meet wacky characters, and manage your resources wisely. And yes: you still can date some hot monsters!",https://www.igdb.com/games/monster-prom-3-monster-roadtrip,,,13,1,2,3,191075,,,,,21065,21066,21067,,14,,,,,,,,5,"Hit the road with ""Monster Prom 3: Monster Roadtrip"", a vibrant sequel that twists the Monster Prom formula in an exciting new way. At its core, this is a very similar game: a multiplayer narrative adventure full of colorful characters and fresh funny dialogues. But this time the goal isn't getting a date, but surviving a road trip (although you still can score a date if you play wisely).

You and up to 3 friends will face all kinds of wacky conflicts, choosing from options in order to manage your road trip resources. If a resource hits zero... you can kiss your trip goodbye! But fulfill the right requirements and you may reach one of the dreamy destinations that will put an epic end to this experience.",,,4,,,,,,,,,,,,,,,,,,,,
Danganronpa 2: Goodbye Despair,9694,"24,234",914,"25,148",94.17%,9694,0,115579,1343260800,3,6,danganronpa-2-goodbye-despair,"The follow up to Danganronpa: Trigger Happy Havoc. The main character, Hajime Hinata, a new 'Ultimate' student at Hope's Peak Academy. On their first day, Hajime and all of his classmates are taken on a field trip to the mysterious Jabberwock island by their anthropomorphic rabbit teacher, Usami. Usami explains that on this island the students are to have fun together and become friends to gather Hope Fragments. Usami's field trip does not go as planned when Monokuma appears and begins a new Killing Game. Anyone that wants to leave the island must commit a murder and get away with it. If the murderer is successful, he/she is allowed to leave the island, while everyone else is killed. When a murder occurs, the player investigates. After the investigations, a trial commences to determine who the culprit is.",https://www.igdb.com/games/danganronpa-2-goodbye-despair,85,10,,1,,,23117,34961,68752,,,,,,,14,38,46,130,,,,,1,,1718,25980,,,,,,,,,,,,2,,,,,,,,,
